,text
5098,SavageNation Reminds me when the Peasants destroyed their food when Stalins army came to redistribute the wealth It caused faminedeath
9514,RT AbbsWinston Zionist Terrorist kidnapped 15 Palestinians in overnight terror on Palestinian Villages  
8103,10MonthOld Baby Girl was Rescued by Coastguard after She Floated HALF A MILE Out to Sea socialnews 
1879,JanelleBrown117 YES We are comrades in sweatseeking calorieburning cardiotorture We need all the support we can get smile nod wave
2672,master0fsloths has a crush 
7678,"jamesjustus returns her

Relax You know I always return her so no need to panic I just gave her some of those corn flakes P"
8849,wizkhalifa smoke so much you dont gotta do shit but light one of his locks on fire  thats like a whole tre five right there
189,JadeForMKX You should be happy I dont use Aftershock That variation counters your play style hard
2883,Nine inmates charged with causing damage in Calgary Remand Centre riot  
5876,The Stephen Ave flower pots got a little ripped up in the hailstorm today yyc abstorm calgary iamdowntown 
10634,Police Officer Wounded Suspect Dead After Exchanging Shots Richmond police officer wounded suspect killed a 
8850,And all you girls that smoke have you notice that you started to lose ALOT OF WEIGHT  HMMM Dont know body want no thin girl tf
2844,"Some drugs and alcohol in Jackson Vroman house

"
10225,The highlight of my day has been playing with my raw volcano humidifier sicklife 
8312,Chinas Stock Market Crash Are There Gems In The Rubble 
2327,I liked a YouTube video  Eminem feat Nate Dogg  Till I Collapse
9615,Severe Thunderstorm Warning until 1030 PM local for Oklahoma County in OK 60 Mph Wind Gusts And Half Dollar Size Hail okwx myswc
10443,Several wild fires have burned a lot of land in California Here is one of the larger fires  
1340,troylercraft YEAH ITS NOT WORTH IT BC HE ALREADY HAS SO MANY SPAMMERS amp HIS TWITTER IS PROBABLY BLOWN UP EVERY SECOND
2934,TheTXI GunnersFan89 why would arsenal fans want that West Ham will be in a relegation battle this season no danger for AFC on sun
8715,In the movie Titanic Jack and Rose both could have stayed on the wooden beam without it sinking
7812,Reddit updates content policy promises to quarantine xtremely offensive communities 
10663,Cutting for some celebrety and then posting the wounds online is a nogo
6861,If abortion is murder then blowjobs are cannibalism and masturbation is mass genocide
1481,Body Bags 1993 Movie Review  via YouTube
9961,heleneyancey GodsLove amp thankU my sister Helene for RT of NEW VIDEO  The Coming Apocalyptic US Earthquake amp Tsunami
2143,twlldun peterjukes Its a very good piece And I agree the failure of postwar planning was the catastrophe
1297,zhenghxn i tried 11 eyes akame ga kill and tokyo ghoul all damn bloody i dont dare watch
8259,"evacide The Ferguson RIOTS worked This of this the next time you say RIOTING doesnt change anything

There fixed it for you"
9519,ShipsXAnchors IDEK HOW IS  THERE PEOPLE WHO ACTUALLY THINK HES A TERRORIST
10288,Abe government said the missiles were not weapon so JSDF could provide them to the ally when collective self defense right was exercised
9809,Students suffering from trauma  like divorce violence amp poverty  often act out Schools are trying a new approach 
5628,Cuban leader extends sympathy to Vietnam over flooding at 
218,"This is unbelievably insane
man airport airplane aircraft aeroplane runway accident freaky "
1257,youngthug Remind Me of Blood Sosa From Bellydo your homework
6813,tianta Breaking news Unconfirmed I just heard a loud bang nearby in what appears to be a blast of wind from my neighbours ass
9747,Rly tragedy in MP Some live to recount horror When I saw coaches of my train plunging into water I called  
5559,SatanaOfHell ever seen by far A dreamy look came over his face and his ears flattened as he started to walk slowly toward her Youd
8837,Marketforces Cat Shark wins Sirens round two  radio news
3951,"In Kalmikya Astrakhan Volgagrad and Dagestan there is already no food left for the locusts

   via TIMEWorld"
10540,Reality Training Train falls off elevated tracks during windstorm  Paramedic EMS
5114,Roger Goodells Fatal Mistake Tom Brady An Innocent Man 
10729,Omg if Cain dies i will be an emotional wreck emmerdale
5789,"GREAT MICHIGAN TECHNIQUE CAMP
B1G THANKS TO bmurph1019 
hailYoutsey  termn8r13 
GoBlue WrestleOn "
2318,I get this feeling that society will collapse or implode So dont be a hero and play your part
855,FedEx stops shipping potential bioterror pathogens FedEx Corp NYSE FDX will no longer deliver packages that 
1438,cameron13131313 OtooleDalton averywelch23 otoole1055 first of all you cant hit stick shit Second Im body bagging you on sight 
3797,it sure made an impact on me 
10624,Officer Wounded Suspect Killed in Exchange of Gunfire 
9029,Keep shape your shoes Amazon foot adjust shape shoe Mini Shoe Tree Stretcher Shaper Width Extender Adjustable 
1074,My ear started bleeding again
9293,Parental experience may help coral offspring survive climate change Preconditioning adult corals to increased 
8897,Tess was almost born in a snowstorm I was 39 years ago Heres her birth story  VBAC NaturalBirth
947,niggas love hating
4609,Were hiring Read about our latest job opening here RN Nurse Shift Manager Emergency Services  Full time  
7151,Tajikistan Mudslides China aids to Mudslidehit Tajiks 
2297,"Jumps off of a cliff while drinking tea

This is how British people fall off cliffs"
2034,Catwoman1775 Another shooting in a movie theater this is getting more crazier but Im glad they got the shooter amp no casualties
2843,cyclonereizei If I may ask Cyclonesama have you read Jailed Fate by Rindou
4949,"that exploded amp brought about the
beginning of universe matches whats
mentioned in the versethe heaven and Earth
thus the universe"
4871,My ears are gonna explode smh
10715,Wreck with road blockage Woodward Avenue Northbound at Davison in MS shoalstraffic
4620,Removing tsunami debris from the West Coast Karen Robinson Enviromental and Emergency services manager of the 
9168,More details Bomber kills at least 13 at Saudi mosque in Asir  including 10 members of special emergency forces 
1311,I swear my eyes be bloody red but bitch I feel amazing
401,RT janenelson097 RT StephenSCIFI Adaptation Watch Charlie Humans APOCALYPSE NOW NOW Optioned for Film sciencefiction 
6480,BreakingNews Militants attack Udhampur police post 2 SPOs injured 
4000,More Natural Disaster Research Urgent  via JakartaPost
5513,jackcarter22 me and bricktop were laughing about him on sunday when he flattened 3 or 4 arsenal players from a corner  tank VaVaZouma
4610,veterans VET Act would ensure every military veterans access to highest level of emergency care services Proper treatmen  followme
5598,Spot Flood Combo 53inch 300W Curved Cree LED Work Light Bar 4X4 Offroad Fog Lamp  Full re  
7273,3 former executives to be prosecuted in Fukushima nuclear disaster 
5433,Attention Service Members Veterans Educators First Responders in Jacksonville FL 
10359,DorisMatsui thank you for supporting the President The IranDeal takes nuclear weapons out of the hands of Iran and keeps everyone safer
3970,PamPalmater i agree with perrybellegarde to get out amp vote Look at devastation pmharper caused FirstNations IdleNoMore cndpoli yyj
1341,White family supposedly representing Americas GREAT values  gets blown up in a horrible CGI nuclear strike LMFAOOOO
492,RohnertParkDPS Youre on stage now Right under the lights Isnt it funny Where do you get the goofballs with which you staff your PD
8609,The 08062015 AlabamaQuake seismic summary w earthquake news amp history  
6116,Hellfire is surrounded by desires so be careful and dont let your desires control you Afterlife islam
2885,Does homeowners insurance cover water damage Here are some good things to know  
8978,ice cream  cupcake wars  storm  content sara
1836,All you have to do is look up sports riots on google and youll see more than couches being burned You fr gotta go 
10111,USW The damage from abandoning the deal could well create a new level of uncertaintyeconomic upheaval amp military unrest
1829,This is why you should be burned at the stake  
10254,Just watched Punisher War Zone IDK why everyone hates it It is basically the best possible movie you could get out of Punisher
1294,TradCatKnight 1 Russia may have played into reason but that link is BS  Okanowa was bloody and mainline invasion looked like a bloody
5012,Read an eyewitness account from Hiroshima on Aug 6 1945  Mankinds worst invention
873,FedEx no longer to transport bioterror germs in wake of anthrax lab mishaps 
3987,At least 18 houses 5 bridges destroyed in flash floods in GilgitBaltistan on Wednesday  
1414, New Ladies Shoulder Tote Handbag Faux Leather Hobo Purse Cross Body Bag Womens  
86,"Progressive greetings

In about a month students would have set their pens ablaze in The Torch Publications "
2711, WRAPUP 2US cable TV companies shares crushed after Disney disappoints 
1730,THIS SOUNDS LIKE A SONG YOU WOULD HEAR IN A MOVIE WHERE THEY ARE WALKING AWAY FROM BURNING BUILDINGS AND CARS AND SHIT
10150,To navigate inevitable upheaval internal audit must lead the way 
3587,fotofill It looks so desolate End of the world stuff Gorgeous
8420,Watch This Airport Get Swallowed Up By A Sandstorm In Under A Minute 
4625,Can you recommend anyone for this job RN Emergency Services Full Time 3p  330a Rose de Lima Campus   Hiring
4359,19 earthquake occurred 15km E of Anchorage Alaska at 0011 UTC earthquake Anchorage 
776,FC Maid Agency presents Musician Kalle Mattson Recreates 34 Classic Album Covers in Clever Music Video for 
5595,Spot Flood Combo 53inch 300W Curved Cree LED Work Light Bar 4X4 Offroad Fog Lamp  Full re  
8338,360WiseNews  Chinas Stock Market Crash Are There Gems In The Rubble 
2793,Rite now man a tlk widout nuh curfew long side Aka cum fi steal di show itz a rubbery di whole a dem fi knw Sound it music
5916,"SO MANY SECURITY GARDS THIS IS GOOD 
I DARE THEM TO LET SOMEONE HARM HARRY OTRAMETLIFE"
7382,Will Trump obliterate opponents as quick as Rousey
336,TomcatArts who then were annihilated by the legion itself The survivors of the imperfect hybrid project quickly formed a new secret cell
7905,Radioactive Box Quarantined  Israels Ashdod Port was evacuated when emergency teams discovered radiation emittin 
10513,I honestly wonder what it is that I had to do so wrong to lose everyone
9789,Hollywood Movie About Trapped Miners Released in Chile The 33 Hollywood movie about trapped min  topstories
8011,imagine an entire aisle dedicated to making people look like serbian refugees  director of whole foods clothing section
7560,Families to sue over Legionnaires More than 40 families affected by the fatal outbreak of Legionnaires disea 
8246,Money cant buy happiness is just a lie we tell poor people to keep them from rioting
8207,To All The MeatLoving Feminists Of The World Riot Grill Has Arrived 
1803,What news reports am I missing Are there buildings on fire people shot etc due to videos PPSellsBabyParts 
2304,Runaway Minion Causes Traffic Collapse in Dublin 
163,Aftershock 
8856,In 2014 I will only smoke crqck if I becyme a mayor This includes Foursquare
4885,Facebook Influence 20 Simple strategy to explode your Facebook page and create more 
7330,Finnish nuclear plant to move ahead after financing secured  via business
9390,Trapped a bee in my shoe only one of us survived I just ran 015 mi  a 1346 pace with Nike  nikeplus
4460,Almost electrocuted myself 
6993,Saturday Night Massacre  25 Years Later TomLandrys Firing Still A Day of Infamy 
2716,So in one episode they undo season 1 Kai joins FF Ren beats Aichi with Psy  and misaki gets crushed  What the fuck
1390,Photo Bath amp Body Works cosmetic bag in periwinkle blue with copper piping along the top and four corners 
9241,MUSTSEE Massive ISIS Suicide Truck Bombing Caught On Tape  via GabbyOgbechie1TPGazette
3122,MH370 debris found on reunion island  sad tragedy innocent crash mh370
4101,US record hurricane drought 
9563,The worst part is seeing lightning and trying to guess when the thunder will crack
8515,stvmlly Sorry for screaming at you and Safferoonicle from the car I just kinda I KNOW THOSE PEOPLE LETS YELL 
2856,I liked a YouTube video  GTA 5 Online  COLLATERAL DAMAGE GTA V Online PC
9422,The second part which focuses on the survivors is really difficult to watch but at the same time is really powerful
8388,You can only make yourself happy Fuck those tryna ruin it keep smiling 
10057,jrlallo My narrator will have to say chemically interesting lavatory for DB5 Not quite the tongue twister but certainly odd P
6761,Baby youre like lightning in a bottle
9005,organic natural horn stretcher expander earrings body jewelry with painting in tribal   
488,Remember to crowd around the baggage carousel like its armageddon and the bags are the last remaining food items on earth you animals
7426,Drunk Meals 101 What To Cook When Youre Totally Obliterated 
4365,USGS M 12  23km S of Twentynine Palms California Time20150805 235409 UTC20150805 165409 070  SM
7150,PeterKnox Gemmasterful I think the mudslide cake lady will go and the hipster will unfortunately stay
8524,ArianaGrande justinbieber All the loves be screaming at this one 
681,India shud not give any evidence 2 pakThey will share with terrorists amp use for next attackShare with oth contries 
9672,Dakota Skye gets horny with some porn then gets her juicy pussy pounded  View and download video
1919,2 Burning Man Tickets  Vehicle Pass  Full read by eBay  
4417,stay with me  samsmith
97,Accident on I24 W NashvilleTraffic Traffic moving 8m slower than usual 
429,My niece just asked me would you be scared if there was an apocalypse here 
7219,Expert Prepper Financial Collapse Natural Disaster Failed Grid  
6127,Hellfire Gargoyle Hoof coil 
7824,Reddit Will Now Quarantine Offensive Content  onlinecommunities reddit via wired
3504,Service on the Green Line has resumed after an earlier derailment near Garfield with residual delays
7261,3 former executives to be prosecuted in Fukushima nuclear disaster 
9764,onihimedesu the whole city is trapped You cant leave the city This was supposed to be a normal sports manga wit a love triangle c
9071,Investigators have said a Virgin Galactic spaceship crash was caused by structural failure after the copilot  
8139,Newborn piglet running down a national speed limit road is rescued oink Dorset  
5568,If you decide to get rid of flood damaged furniture solid waste will pick it up for a fee You can call Tampa Solid Waste at 8132748811
20,Damage to school bus on 80 in multi car crash BREAKING
4715,"So again make sure to evacuate past the fire doors Any questions Yes
Why would we open the doors to the fire

III cant"
2772,karliknox you know how crazy strict Philip is he gave me a 10 texting curfew bruh
1936,Firefighters are some brave people in my opinion bc I clare I dont know I could save ppl from burning buildings and houses I salute them 
3314,It was finally demolished in the spring of 2013 and the property has sat vacant since The just saddlebrooke 
10701,im an emotional wreck watching emmerdale fml
7996,The Latest More Homes Razed by Northern California Wildfire  ABC News 
1031,Threw a chicken nugget at my sisters lip and now its bleeding
5130,11YearOld Boy Charged With Manslaughter of Toddler Report An 11yearold boy has been charged with manslaughter over the fatal sh
5692,Nearly 50 thousand people affected by floods in Paraguay   
2959,"remember that time goku gave life to a dead birb 
what the hell goku"
3452,Sound judgement by MPC  premature rises could derail recovery Business 
7322,Steam pipe problems sideline US Navys 3 newest submarines breaking news My story at  
9139,16yr old boy pic PKK suicide bomber who detonated bomb in Turkey Army trench  
1830,Let me tell you Brandace brought it today at NTC Heat and allwe survived Burned over 500 
4461,South Side factory where worker electrocuted pays 17000 penalty Columbus 
7190,bottleowhite i had to cover my eyes with the mudslide toopainful
9154,Suicide bomber kills 15 in Saudi security site mosque  Reuters Canada Reuters CanadaSuicide bomber kills 15  
744,MageAvexis lt things And what if we get attacked
6026,MTR issues Hazardous Weather Outlook HWO 
8758,So when r u getting marriedFoxySiren Oh finally Jennifer Aniston got married Im so happy for her 
3764,Dont be the cause of your own self destruction
1766,saving babies from burning buildings soaking cake in a shit tonne of alcohol mat is a man after my own heart  GBBO
2533,Riverside I15 N Sr91 E Con  I15 N Sr91 W Con Trfc CollisionUnkn Inj 
3641,4 The Hobbit The Desolation of Smaug Bilingual 
8157,The Rescuers and The Rescuers Down Under are on Netflix Youre welcome
7448,Why Did God Order Obliteration of Ancient Canaanites Bible Scholars Say Dire Warnings for America Lie  NEWS
6351,Militant Overpowered By Hostages After Attack 
1158,220 BLIGHT  EVERY DAY
4559,go2MarkFranco I spoke w Caleen Sisk If ShastaDam gets funded through Cali Emergency Drought Act I plan on doing story wfocus on Winnemem
5531,Conklin being flattened Shuffled feet instead of kick slide Didnt get hands up into chest 
2063,Propertycasualty insurance rates up 1 in July After several months of no movement commercial propertycasu 
5448,York Co first responders compete to save lives in adges for Blood paramedic EMS 
3916,Obama Declares Disaster for TyphoonDevastated Saipan Obama signs disaster declaration for Northern Marians a 
9994,Dr Jim amp the tsunami The latest New Yorker warned us in no uncertain terms Havent you heard The tsunamis 
6764,Science Daily Lightning reshapes rocks at the atomic level  A lightning strike can reshape a minerals crystal s 
10363,Abe proposed a new plan for abolishing nuclear weapons Yesterday his defense minister made clear nukes are fine 
4437,Photo weallheartonedirection I wouldnt let David electrocute himself so Im the asshole 
5334,I just watched Halt and Catch Fire 2x10 Heaven is a Place  trakt
9179,Suicide bomber kills 15 in Saudi security site mosque  mercados
1716,Two giant cranes holding a bridge collapse into nearby homes 
5429,What Ill miss the most is that very rare occasion where you and the first responders on scene are the difference between life and death
6157,Chrysler Jeep wirelessly hacked over internet to hijack steering brakes and transmission face lawsuit  should all consider ISO27001
3700,justicemalala nkeajresq Nkea destroyed lives in Gambia as a mercenary judge
4771,More than 300 campers evacuated as California wildfire blazes on officials say 
3244,Businesses aredeluged with invoices Make y urs stand out with colour or shape and its likely to rise to the top of the pay pile
741,LogitechG BUT THEN THE FIRE NATION ATTACKED
4244,HOPE THE DROWNED eeasterling2
1887,Leader of Zionism STOP BURNING Babies  
6688,landslide while on a trip in skardu 
541,One Direction Is my pick for  Fan Army Directioners  x1424
1756,EPCOTExplorer my jealous tears are burning with the fire of a thousand ransacked buildings SO AWESOMEEEEEEEE
5412,Im grateful for our first responders  MNPDNashville NashvilleFD and others  who acted so swiftly to save countless lives today
919,cspanwj If 90BLKsamp8WHTs colluded 2 take WHT F USAgov AUTH Hostageamp2 make her look BLK wBioterrorismampuse her lglorg IDis ID still hers
3461,lizkhalifa no passenger train derailed earlier this morning
727,Kelly Osbourne attacked for racist Donald Trump remark about Latinos on The View 
6676,So cool GarbanzoBean23 in the news Cutest INDOT worker but I might be a little bias  
5352,In the words of Charlie Daniels Fire on the mountain run boys run 
9878,viennabutcher ITS NOT FUNNY IM TRAUMATISED
2766,ExOfficio Mens Boxer Brief Curfew Large 
10452,myralynn24 Becuase it can cause property damage and cause wild fires
2236,Nueva favorita EmergeNCY feat The Chemical Brothers  My Bits  DeezerColombia
806,What really happened in the Taken King Story Trailer A space battle that ripped a hole in Saturn EyTay neur0sis 
1959,Strikers in Phalaborwa striking over the CHINESE taking their jobs Strikers burning buildings attacking cars 2 
5438,"SPD OFFICER SHOT  PLEASE PRAY

Please pray for the Shreveport Police Department and other first responders "
9951,corcoran30 kmurphalurph when these two are in the building laughs and trouble haha Great 
6308,my chacos were supposed to arrive by 8pm why are you holding them hostage ups I just want some crunchysensible footwear
3618,Watching The Desolation of Smaug in Spanish is a hell of a drug
5575,CreationMin rwrabbit GoonerAtheist atheistic1 LOLatJesus Yet still why did so many fish die in the worldwide flood I wonder
3118,    MH370 Aircraft debris found on La Reunion is from missing Malaysia Airlines   
7174,"LollyKnickers Its a mudslide 
Its like chewing on a rubber tyre
And with those Im DONE
vaginaorcake GBBO"
3834,Ive just signed up for the Detonate Nottingham Autumn Launch Party Register here 
6101,Hellfire is surrounded by desires so be careful and dont let your desires control you Afterlife
8156,AndyGilder Channel 5 have been doing the same for the RSPCA with Dog RescuersThe Infomercial has crept in the back door
876,USATODAY On todays frontpage Bioterror lab faced secret sanctions RickPerry doesnt make the cut for FoxNew 
8268,Dont use Allahuakbar and start rioting Do you guys even listen to yourselves SHAME
976, Yes I do have 2 guns  
9207,Suicide bombing at location named premonitions 
6048,Something Frightening is Happening to the Weather in the Middle East 
1027,"S3XLEAK
Ph0tos of 19yrs old Ashwo lady in Festac town from Delta exp0sed on BBM 5 leaked pictures "
8726,"In your eyes I see the hope
I once knew
Im sinking
Im sinking
away from you
Dont turn around
youll see

You can make it"
10761,Wreckage Conclusively Confirmed as From MH370 Malaysia PM Investigators and the families of those who were 
524,"You da One 

MTVSummerStar VideoVeranoMTV  MTVHottest Britney Spears Lana Del Rey"
869,FedEx no longer to transport bioterror germs in wake of anthrax lab mishaps  newsdict news  FedEx
3599,Now Playing Desolation Wilderness by Kodak To Graph
2099,Casualty insurance jobs against hunt up willinghearted into RPN 
7262, Japans Nuclear Disaster and its ongoing side effects
10315,Abes government made clear that grenades were not weapon
8481,moganwilson Verrry mad like I just screamed Im so pissed
10675,Court back in session Testimony continues with med examiner discussing gunshot wounds KerrickTrial
7456,I need an arcade shooter fix but CTE is empty amp only running obliteration Id even buy a CoD title if they werent all overpriced on steam
5259,Fatality 
6668,Latest Landslide kills three near Venice after heavy rain 
4167,when your moms being annoying so you turn your beats pill all the way up to drown her out
1338,aunt marge youre blown up eheks
10308,Pulse rifles after weapon tuning 
9278,ltlt his lip as he sunk into the bed his arms crossed behind his head as he watched his Captain do a number on his body ResoluteShield
2228,Emergency services called to Bacup after strong chemical smells 
6014,Also confirmed by Senate Marie Therese Dominguez to be Administrator of the Pipelines and Hazardous Materials Safety Administration PHMSA
677,Police Assailant in latest US movie theatre attack was homeless had psychological issues 
5648,Now WoW folks Im sorry for all the prepared jokes that must be flooding your feeds right now
2542,Head on head collision Ima problem and nobody can solve em on Long division
1234,Broke my nailreal not fake this morning blood and all ah it hurts any ideas how to treat it Help me pretty please  
7529,TroySlaby22 slicker than an oil spill
5349,JustinLing I promise not to tax pancakes or rainbows or not dying in a fire
8762,tomarse99 they all are intending to go Just waiting for winds to drop Siren just gone off to signal they allowed to leave arenanone gone
9387,There are people who plotted against me that are still wondering how I survived
2276,Huge cliff landslide on road in China Watch the moment a cliff collapses as huge chunks of rock fall onto a r 
9886,Im so sad Kids Company has closed After all the talk thousands of traumatised young people will suffer But 
490,Paul Craig Roberts  Vladimir Putin Issues Major Warning But Is It Too Late To Escape A  brics roberts russia
7246,Chronicles of disasterHiroshima in the Yale Library archives   Calls to end absolute evil of nuclear weapons
3040,A single death is a tradery many deaths is statistics
10047,rodarmer21 10 dolla says wicked twister wont be running
10463,Stampedes and fires brought him home can her love make him stay TAME A WILD HEART audiobook  BYNR BeingAuthor
6052,Its nice out Guessing the heat wave is over
3171,Why so many halfnaked men on Twitter tonight Normally Id embrace the odd torso but the scale of tonights deluge is unprecedented
1742,kou is like CASH REGISTER BUILDINGS BURNING
2017,LibertarianLuke Im all for that to be honest If people want to go on a rampage let them use their own hands and feet No casualties
2253,Emergency prompted due to chemical spill at a factory near RedruthUK  
3153,Dustpiggies ah I was awash with abstract Dustpig tweets then Explains the deluge
7549,Families to sue over Legionnaires More than 40 families affected by the fatal outbreak of Legionnaires disea 
6002,0913 PM  Hazardous Weather Outlook  NO HAZARDOUS WEATHER IS EXPECTED AT THIS TIME 
2106,business casualty
6314,Islamic State group in Egypt threatens to kill Croat hostage 
7467,Back in 02 to 03 would never said that 50 would have ended ja like obliteration
4184,We are getting some reports of flooding near Jonesboro High School Please use caution when driving in the area Turn around dont drown
3197,Whats missing in the asae15 exhibitor emails Value  assnchat
8833,Fire truck sirens for the past ten minutes straight coming and going Must be huge Maybe its taco bell and theyll build a Sonic instead
