,text
2738, my soul just crushed because they were so damn cute  
6245,hot  Funtenna hijacking computers to send data as sound waves Black Hat 2015  prebreak best
3144,Debris confirmed from MH370 relatives hope for discovery of crash site  via Reuters Video
7691,just had a panic attack bc I dont have enough money for all the drugs and alcohol I wanted to buy this year let alone my fall bills
6724,"
SON OF SAVIOR LAVA VIDEO"
3158,Niagara Falls Package Deals Deluge Tours YYESO
2965,lmfao fucking luis hhahaha im dead
521,5 Seconds of Summer Is my pick for  Fan Army 5SOSFAM   1
4376,USGS EQ M 19  15km E of Anchorage Alaska Time20150806 001116 UTC20150805 161116 080  EarthQuake
514,Show Me a Hero TV Review  
3863,Ignition Knock Detonation SensorKNOCK SENSOR Delphi AS10012  
1967,"You picture buildings burning to the ground from the basement to the streetlight 

Im not your drinking problem
a hole is in the sky"
7316,NuclearDeal IndoJapan pact lies at the heart of two US reactorbased projects If Japan were to go ahead an  
766,PLUS PERFORMANCE CHIP FUEL SAVER CHEVY SILVERADOAVALANCHEBLAZERTAHOE  
6201,Governor Allows Parole for School Bus Hijacker 
9727,MeekMill Have your beef Idgaf but you went too far when you used a tragedy where PEOPLE DIED to insult Drake You owe TO an apology
3372, Demolition company der abbruchsimulator
3009,Death threats on a nigga life well then we gon see
100, Had a personalinjury accident this summer Read our advice amp see how a solicitor can help OtleyHour
9670,Second tornado confirmed in Sundays storm 
3212,Glimpses Hyderabad deluged by heavy rainfall   
4929,I read about that break for hours before twitter noticed it and I though that is nothing to worry about bc twitter wasnt exploded bc of it
6053,"UAE cool to Mideast heatwave rain watch latest video
NCMS issues warning of thundering rain poor visibility "
6741,HE SAID THE DOMINOS LAVA CAKES WERE BETTER THAN CULINARY CUISINE
1752,I Pledge Allegiance To The POPE And The Burning Buildings of Epic City 
3462,DC Media tip for getting updates on the derailed WMATA train today  ask them about movie night and quickly change the subject
6144,Tension In Bayelsa As Patience Jonathan Plans To Hijack APC PDP  The Sun Plans by former  
2829,"Bank manager asks Tom in an interview What is cyclone
Tom It is the loan given to purchase a bicycle"
7810,Bangalore  Reddit updates content policy promises to quarantine extremely offensive communities  Startups  in
5358,Politifiact Harry Reids 30 Percent of Women Served Planned Parenthood Claim Is a Pants on Fire Lie Call 
4021,Metepec Mexico  NIGHT DISASTEREOficial  NitClub msica msica 
6288,Ya kisses hold me hostage amp I dont wanna stop it I only wanna give it to you
640,kill i got court the day after earl
9976,An optical illusion  clouds rolling in over the mountains looks like a Tsunami  Geneva  Switzerland 
10446,God forbid this is true California has enough problems with severe drought amp wild fires  Nuclear Power SanOnofre
2374,Zimbabwe is a country with a collapsed government ruled by a dictator while many live below the poverty line
9220,Turkish troops killed in Kurdish militant suicide attack 
7835,Reddit Will Now Quarantine Offensive Content 
82,They sky was ablaze tonight in Los Angeles Im expecting IG and FB to be filled with sunset shots if I know my peeps
1487,BoomerangTime RSKarim1 sopameer wattashit3 Appears to already be arriving in Ridah in body bags
8072,XManKitty WolvenBeauty NickWilson Shitalright time to launch a black ops mission to rescue my alpha
3507,Google News  A Twin Train Derailment in India Leaves at Least 24 Dead  TIME  world
10822,Caitsroberts see U the night wee bArra to get absolutely wrecked 
2540,Traffic Collision  Ambulance Enroute Elkhorn Blvd at Walerga Rd Sacramento 
12,Were shakingIts an earthquake
7798,Reddit Will Now Quarantine Offensive Content via Wired 
7932,If you cant have the roar of the waves a rainstorm amp some rolling 
5619,Tips to prevent basement leaks  Create control joints to eliminate random cracking homeimprovement Flooding 
10459,California wild fires blow my mind every time
5300,Untangle yourself from requiring your partner to fill your needs and how to love without fear BestTalkRadio Listen 
2675,Ron amp Fez  Daves High School Crush  via YouTube
10629,National free root beer float day is tomorrow at AampW from 2pmclose Help support the Wounded Warrior Project with donations 
7710,I deserve a goddamn medal for dealing with this basement flood without panicking
7517,National Briefing  West California Spring Oil Spill Estimate Grows Documents released on Wednesday disclos 
10075,Typhoon Soudelor taking dead aim at Taiwan 
8508,noahshack hes hot amp he can sing Im screaming
8062,Coastal German Shepherd Rescue OC shared a link  animalrescue  
9950,PrinceofFencing frickin summer and its humidity building up and causing trouble
6166,welshninja87 click on the tag theres lots of them RT them to hijack the hashtag
813,JackiSheaffer I have the same battle
2007,The Bush fires in CA are so crazy
6379,Deosl86 That does nit change the fact extracting hostages is pointless
7368,This is progress Weaponry to obliterate every trace of natural life This is absolute total lunacy Hiroshima 
9653,935 pm Thunderstorm No rain 90 degrees This weather weird
2020,Need to stop bottling things up because when everything eventually explodes the casualties just keep getting higher and higher
10251,Zone of the Enders MGS2 God of War RT DPageXXI Quote this with your favorite PS2 game
905,StationCDRKelly Any Support Sys 4 USAgov AUTH taken Hostage by BLK US clergyforced 2 exist youngerampgrossly disfigured by BIOTERRORISMAP
2029,Memorial day of 70 years Hiroshima and Nagasaki 69 august 1945 wth total casualties 200000  God forgive them
5684,Download  iTunes  Floods Of Glory by Luiz Santos jazz art Music
7928,Landslide in Italian Alps kills three ROME Reuters  Three people were killed when a severe rainstorm in th 
9431,aceless body belonged to my sister Hiroshima Nagasaki nuke survivors recall horrors 70 years on  RT News 
6354,"No news of hostages in Libya



India terrorism Africa AP TS NRI News TRS TDP BJP "
3044,Afghan peace talks in doubt after Mullah Omars death  Financial Times  Mullah
9303,Ended todays staff meeting with the teacher version of I Will Survive tootrue 
7088,Meltdown
2538,"my favorite lady came to our volunteer meeting
hopefully joining her youth collision and i am excite "
1030,Do people not understand they cant bleeding tweet everyone all the timedoes me head in stop ignoring me they are hardly ignoring you
5659,Thankkk U all Soo much for Flooding my NotificationsU my Fella ParShOlics r Superb amp Jus soo awesomeLove Love U All always FrvrGrateful 
6449,Arian Foster does keep his promise And thats to get injured every yeat
261,news Twelve feared killed in Pakistani air ambulance helicopter crash  tilnow DNA
4453,Ive had electrical tape wrapped around my charger for like 2 months bc I dont want to get electrocuted  
1535,The Guardian view on the Hiroshima legacy still in the shadow of the bomb  Editorial The world longs to cas 
4750,pantalonesfuego Yeah I grew up in the canyon above LA We had to evacuate a few times
5671,Cyberdemon531 i hope that mountain dew erodes your throat and floods your lungs leaving you to drown to death
9001,How to restore vinyl siding and make it look new again  
9627,iNWS Alert SPSGSP from 852015 1040 PM to 1115 PM EDT for Pickens County STRONG THUNDERSTORM WILL IMPACT 
70,Burning Man Ablaze by Turban Diva  via Etsy
10535,For sixth year in a row premium costs for windstorm insurance to climb This time by 5 percent GalvNews  
2505,Zojadelin you literally almost had a head on collision with us today on pilot knob
4452,So I had my phone charging and lightening struck in my backyard and I was holding my phone and it electrocuted my hand hurts so bad man
9075,Investigators have said a Virgin Galactic spaceship crash was caused by structural failure after the copilot unlocked a braking system
1345,And my mentions are blown up for what  wtf
1113,The 1st time someone blew up my phone 30 times they would be blocked Believe it  Catfish
9200,"Erdogans Bloody Gambit 
Max Zirngast in Jacobin
On July 20 a suicide bombing took the lives of thirtyone "
4478,I was working out today and i sweated SO MUCH like i though i was gonna get electrocuted by earbuds omg
4102,Drought report lists SE Texas as abnormally dry  SETXNews
462,PBBan Temporary300 hyiderghost2 aRmageddon  DO NOT KILL  FLAGS ONLY  Fast XP for Reason
3752,Crackdown 3 Destruction Restricted to Multiplayer Crackdown 3 impressed earlier this week with a demonstratio 
5557,100  1 MIX NEW FLAT DOUBLE SIDED LINERLESS BOTTLE CAPS YOU CHOOSE MIX FLATTENED  Full re  
9225,Suicide bombing at location named premonitions 
3778,Whats happening A destruction indeed 
1222,I call it a little bit of your blizzard
2864,Its crazy how a phone can do so much damage to a person
8302,360WiseNews  Chinas Stock Market Crash Are There Gems In The Rubble 
4572,Do you have an emergency drinking water plan Download guide in English Spanish French Arabic or Vietnamese 
2910,DyannBridges yeshayad Check out this rockin preview of ClaytonBryant Danger Zone Coming soon  ArtistsUnited
1124,Zayn just blew up twitter
6149,Biggest security update in history coming up Google patches Android hijack bug Stagefright 
485,OFFICIAL VID gt DoubleCups gtgt  gtgt TrubGME Prod THISIZBWRIGHT gtgt ARMAGEDDON                 
4158,chromsucks dont drown
8592,elephino Thrusta1 no but its a convenient and seismic shift in 6 months from trying to bury the event and now allegedly enhance it
9646,Severe Thunderstorm pictures from across the MidSouth 
7126,Were hiring Read about our latest job opening here Registered Nurse  Callin  Military Program   Nursing
72,Not a diss song People will take 1 thing and run with it Smh its an eye opener though He is about 2 set the game ablaze CyhiThePrynce
1878,hermancranston atk LetsFootball RT SkanndTyagi letsFootball atk WIRED  All these fires are burning through  
7831,Reddit Will Now Quarantine Offensive  onlinecommunities reddit amageddon freespeech 
3228,My brain is deluged with only your thoughts
10626,wwp is serving more than 75k veterans 52k OIFOEF vets have physical wounds many more have invisible ones  client
10521,Reuters Top News PHOTOS The Rocky Fire has grown into Californias most    NewsInTweets 
9546,Angry Orchard Hard Cider Recalled Due To Threat of Exploding Bottles 
3320,Man Cam just demolished his plate His ass was hungry
6787,Cell Phone Shop   629 8Pin Lightning Connector 21A Car Charger For Apple 5 5S 5C 6 6 i 
9044,SpaceX Founder Musk Structural Failure Took Down Falcon 9 
10854,13 Earthquake in 9Km Ssw Of Anza California iPhone users download the Earthquake app for more information 
5707,"gtAs soon as maintenance ends everyone floods the servers
gtServers destroyed by extreme load
gtMaintenance starts anew"
7020,Slayer at Rockstar Mayhem Festival slayer metal concertphotography houston livemusic canon 
9560,"Yr voice ws the soundtrack of my summerDo u know ure unlike any otherUll always be my thunder 
DarshanRavalDZ "
10462,In Europe nature is kind while in US they have tornados hurricanes wild fires earthquakes flash floods mega snow droughts
9234,61alvin Craigyb74 nomar4eva Shahasda80 wherepond trensabby parallelpond the wall Israel erected has stopped suicide bombing
1789,Such beautiful architecture in NYC I love those fire escape routes on the buildings newyork 
1356,"LONER DIARIES

The patterns  on the sand
May have been blown away
The photos in twos
All choked up in flames "
9341,Suicide of a Superpower  Will America Survive To 2025 by Patrick J Buchana  
8381,Dont ruin a good today by thinking about a bad yesterday 
4849,IbrahimMisau  FAAN orders evacuation of abandoned aircraft at MMA  via Twitter 
5363,News On 6 Crew Neighbors Put Out Hallett Truck Fire  
2730,I crushed a 31 km run with a pace of 541 with Nike SportWatch GPS nikeplus 
10613,Police Officer Wounded Suspect Dead After Exchanging Shots  ABC News AN247
9081,CatoInstitute The causes of federal failure are deeply structural and they will not be easily solved 
6140,dreamoforgonon TeeEss not to hijack but as a bona fide cislady I can confirm this as true incidental homosexuality  gaybi for women
9322,Now realized I honestly cant survive without these glasses now lol
3172,theburnageblue yes man i was having a bad week so far but Events  a deluge of favs have turned it right around
8075,Last Chance Animal Rescue has 3 new posts  animalrescue  
2486,Were happily collided 
8702,that horrible sinking feeling when youve been at home on your phone for a while and you realise its been on 3G this whole time
3856,Open forex detonation indicator is irretrievable after this fashion a financial airborne controls SjFEb 
6441,And you wonder why hes injured every year 
8859,niggas selling weed just so they can smoke amp stay high  YALL NIGGA IN THE WAY
9580,Heavy rain frequent thunder and gusty winds moving into parts of Uptown and Midtown   CN 
9474,AdamNibloe Arrest report Affiliation with Terrorism
7695,Have to laughtraders panicking over market down 1 Some see these as positive capitulation THATS A JOKE More to come may be ugly
454,KatieKatCubs you already know how this shit goes World Series or Armageddon
5081,IntlDevelopment Ukraine Famine Monument Erected In Washington  who perished in the Ukraine famine of the 19  
7660,"Tried 2 4get
Feelings of death
Invading panic spawns
Cant concentrate
No 1 relates
Stealing all the light
Spreading thin a soul in sections"
2230,Do you have a plan in case of a pool chemical emergency Learn more here  watersafety CDC
10241,Brian Shaw  JJ Hickson  Kenneth Faried trying to defend LaMarcus Aldridge was A BLOOD VOLCANO 
7491,He is justifying why this quarrel would one day end in d obliteration of what remains as the state of Pakistan 
6830,KijimaMatako Breaking news Unconfirmed I just heard a loud bang nearby in what appears to be a blast of wind from my neighbours ass
4264,jeesss Ethereal7 Hello 911 yeah we have someone drowning here send a medic 
138,Has an accident changed your life We will help you determine options that can financially support life care plans and ongoing treatment
5756,Stubborn forest fires burn in two provinces RZ  Iran IranElection
4773,"Trafford Centre film fans angry after Odeon cinema evacuated following false fire alarm 
 Twitter users tell  "
7696,QuotesTTG Save the panicking for when you get to Helios 
3547,Amtrak Rail Disaster  
8144,VIDEO Were picking up bodies from water Rescuers are searching for hundreds of migrants in the Mediterran 
8311,JasonPope2 JohnFugelsang again I didnt say it was I was referring to the main 2 buildings 7 was hit by rubble
2954,17 dead as Afghanistan aircraft crashes An Afghan military helicopter has crashed in a remote region of the s  
6972,The Fake of Nanking Massacre4 Eyewitnesses English   Obama Clinton Bush GOP ABC CBS BBC CNN WSJ WPO
3330,Six Palestinians Kidnapped in West Bank Hebron Home Demolished  International Middle East Media Center 
953,Yo I got bars and Im not even a rapper
5108,Russian food crematoria provoke outrage amid crisis famine memories  via Reuters
6922,So wait he really not gonna tell his wife that he is a mass murderer now and a cheat derailed itv2Im done with this film 
8202,"teamVODG Discovered by NickCannon 
 ListenBuy realmandyrain RIOT on iTunesMusic iTunes   BlowMandyUp"
147,Please like and share our new page for our Indoor Trampoline Park Aftershock opening this fall 
5655,kwislo I see her flooding at mad decent
1496,Hot Ladies Handbag Leather Shoulder Tote Satchel messenger Cross Body Bags Green  Handbags 
7759,Now Trending in Nigeria Police charge traditional ruler others with informants  murder 
6618,Ever notice if you follow too many fan sites they all seem to run together amp you feel like you are inundated with the same posts over amp over
6990,MartynWaites Its a wellknown fact that the St Valentines Day massacre could have been avoided with some oompahperiod Tom Waits
10720,Dont think I Can take anymore emotional wreck watching emmerdale SummerFate MikeParrActor MissCharleyWebb
206,A girl who died in an airplane accident fifteen years ago
10447,NetNewsLedger Wild Fire Update  August 4 2015 THUNDER BAY  WEATHER  Therewere no new fires confirmed by t 
6995,Tonight Its Going To Be Mayhem  4PlayThursdays Everybody Free w Text 1716 I ST NW 18 
9136,Pic of 16yr old PKK suicide bomber who detonated bomb in Turkey Army trench released  
3363,Factors to Consider When Hiring a Demolition Company nOxDV
7417,This Davies is why you dont play FM tired Obliterated my budget 
400,I liked a YouTube video from teamtwiistz  FUTURISTIC HOUSE Built To Survive The Apocalypse  Minecraft
9603,Did I just hear thunder 
7794, Police Gents Dart Watch Stainless Steel Bracelet and White Dial  Gift Box  
6119,Hellfire We dont even want to think about it or mention it so lets not do anything that leads to it
10020,Brain twister let drop up telly structuring cast EDcXO
2728,CBSBigBrother ouch Clelliyou could almost hear their hopes and dreams being crushed 
4297,Im drowning in hw now and thats wo going to swim ohlordy
1862,AdamRubinESPN I know we have been burned just a week ago in a similar spot but getting MattHarvey33 out o just 88 pitches save some inn
1273,sethalphaeus my personal favorites include paramore muse green day royal blood and 5sos
10224,MrMikeEaton MuazimusPrime hill hill mountain volcano of hell mountain hill hil
9651,A STRONG THUNDERSTORM WILL AFFECT CENTRAL HALIFAX COUNTY THROUGH 1145 PM EDT for Halifax VA till 1145 PM EDT 
835,Jacksonville Busines FedEx stops shipping potential bioterror pathogens 
2148,I had 2 regular coffees and a Rockstar  coffee today and Im still tired
3650,destroy the free fandom honestly
2937,The Danger and Excitement of Underwater Cave Diving  
4935,The Dress Memes Have Officially Exploded On The Internet 
10358,Ukraine argues for US weapons during Pelosis visit to Kiev  
6517,ringsau and injuries can account for elevated levels of tb4 Richard
1119,Lmao that light skin guy blew up on Twitter by talking about how ugly he was as a kid
10036,carolinagutierr grande twister
5031,How Little Boy Affected the People In Hiroshima  Eyewitness Testimonials  
1146,THDA Kicks Off AntiBlight Loan Effort in Memphis  
5803,Strong Thunderstorm 4 Miles North of Japton Moving SE At 25 MPH Large Hail and Wind Gusts Up to 50 MPH Poss arwx 
4738,No dont evacuate the students just throw them in the dungeon That is stupid
2350,"Greeces tax revenues collapse as debt crisis continues
"
2632,This guy bought my car on Tuesday police knocked my door yday cos he crashed n ran amp 2day he text me asking not to send the log book
10596,Twilights Encore Wounded Hearts Book 3 by Jacquie Biggar  via amazon KindleCountdown Sale MFRWauthor MGTAB
8363,Four Things That May Ruin Your Personal Injury Accident Claim 
2212,At FEMAs Center for Disaster Preparedness for a weeklong training on Chemical Biological Radioactive Nuclear   Emergency Response
2144,nar phuket Ultimate preparedness library  Prepare Yourself For Any Catastrophe Over 
2289,News Update Huge cliff landslide on road in China  Watch the moment a cliff collapses as huge chunks of rock fall 
8861,misocapnist One who hates the smell of tobacco smoke UnusualWords 
1360,Even though BSG had been sufficiently hyped up for me in all the years I somehow delayed watching it I was utterly utterly blown away
10554,Windstorm board OKs rate hike before change  politics txlege twia
2823,ERPESTAR i aint a bitch girl popobawa revolves around you the cyclone
9870,Think Im traumatised for life
5574,2pcs 18W CREE Led Work Light  Offroad Lamp Car Truck Boat Mining 4WD FLOOD BEAM  Full rea  
8322,Hiroshima never recovered and all the evidence was smothered under a thick cloud of rubble jayElectronica
7016,TheDreamingGoat mayhem0407 RobertoSAGuedes Mayhem is my husband by the way 
8670,i could die by falling in a sinkhole and id still be blamed for it
4915,KopiteLuke1892 Its broken its fully exploded
2344,ROH3 JFB TFB alrasyid448ItuRasya Correction Tent Collapse Story  ROH3 SmantiBatam ROH3SmantiBatam
10109,Buddha was man for his time  massive urbanisation and social upheaval also challenged Brahmans dominance Genius of the Ancient World
6148,Criminals Who Hijack Lorries And Buses Arrested In Enugu PHOTO DONJAZZY PoliceNG HumanRights  
2659,WCE I cant even lie even tho I cant stand her she still will always be my crush  explicitpretty
5796,Seen on FahloWCW All Hail the Queen  
6302,susanj357 msnbc allinwithchris its like watching a hostage video sometimes  But not always  at least not yet
5984,Road Hazard  E CONFEDERATE AVE SE  MORELAND AVE SE 
3191,houghjeff Crap The Content Marketing Deluge by dougkessler b2b b2bagency  via SlideShare ContentMarketing
9608,Severe Thunderstorm Warning for Oklahoma County until 1030pm Radar here  okwx
6834,ykelquiban Breaking news Unconfirmed I just heard a loud bang nearby in what appears to be a blast of wind from my neighbours ass
8582,QueenWendy go to sleep before someone screams at us
2062,RxCasualty Vpzedd DainttM call
8858,if youre dating someone who doesnt let you smoke leave them and date someone who also smokes trust me 
567,Trial Date Set for Man Charged with Arson Burglary 
2525,The Denver Post  Motorcyclist bicyclist injured in Denver collision on Broadway 
7350,realDonaldTrump to obliterate notion amp pattern political style seemly lead voter beliefs Sarcasm Narcissism RichHomeyDon Swag USA LIKES
5790,np Avenged Sevenfold  Hail To The King
9553,Get access to the most extensive sources of threat information right out of the box Then easily add your own internal intelligence BHUSA
6935,Another White mass murderer Thank God Im from California FrauTrapani
156,320 IR ICEMOON AFTERSHOCK    djicemoon  Dubstep TrapMusic DnB EDM Dance Ices 
8547,screams in 25 different languages
4369,Children traumatised after the Nepal earthquake are educated on coping mechanisms   
2046,The road to power is paved with hypocrisy and casualties FrancisUnderwood HoC 
7308,MaximEristavi Meanwhile in Finland Nuclear project with Russian Rosatom moves on 
8115,Three suspects in police net for kidnapping amp trafficking a 4month old Baby from Kontagora to Aba Baby rescued alive
437,RT GeekApocalypse 4pm GMT Hesse plays dark souls 2 day 9   etcPB
4223,Hundreds feared drowned as migrant boat capsizes off Libya  NLU
1504,baskgod body bags
8166,VIDEO Were picking up bodies from water Rescuers are searching for hundreds of migrants in the Mediterranean after a boat carryi
7444,I think Ill get obliterated tonight
7575,Families to sue over Legionnaires More than 40 families affected by the fatal outbreak of Legionnaires disea 
1079,DamnAarielle yo timeline blew up so damn fast
750,if this fucking is true i will be decapitated and throw my head into a avalanche  
10693,How many cars do those cyclists wreck going past scratching with pedals They should be banned c4news
7086,LeMaireLee danharmon People Near Meltdown Comics Who Have Free Time to Wait in Line on Sunday Nights are not a representative sample 140
2,Heard about earthquake is different cities stay safe everyone
3979,Thorium Radioactive Weapons Scandals murders and environmental devastation  VIDEO 
5587,1 pair new 27w 4  ROUND LED Work Driving FLOOD Light Offroad ATV UTV  Full read by eBay  
1728,fewmoretweets all lives matter Just not a fan of burning down buildings and stealing from your neighbors to protest
6763,Lightning  rebeccafav 
5971,Choking Hazard Prompts Recall Of Kraft Cheese Singles 
3447,im tired of all these AllLivesMatter people they only say this to derail blacklivesmatter they dont do anything for all lives lmfao
6102,JYHeffect my good you stay in NY 
2809,An Appeal By Cardinal Charles Bo SDB  CNUA Dear Brothers and Sisters The  recent cyclone and the massive 
470,RohnertParkDPS Youre another one for the history books Thank the Justice Department And by the way I havent paid income tax in 20yrs
8804,Rappers stop sampling police sirens and start sampling whale song
3802,Apollo Brown ft MOP Detonate  
5816,HailZel man you kno Im there 
1448,Mopheme and Bigstar Johnson are a problem in this game body bagging niggas VuzuHustle
9219,Turkish troops killed in Kurdish militant suicide attack 
3481,Oh wait I expected to go a totally different route in LS that was derailed by another barely passing grade in a required course Super
9059,Virgin galactic crash early unlocking of brakes triggered structural failure  Irish Examiner 
10143,Ancient Mayan Tablet found via    
5700,No Floods MTVHottest Lady Gaga
1200,This game drove me to a rolo mini blizzard
1347,That moment when ur about to win a mini uhc and than get blown up by a creeper and get kicked for flying So salty rn
3980, From Devastation to Elation Getting Back on My Feet Helping Those Willing To Help Themselves 
8447,I JUST SCREAMED SIDJSJDJEKDJSKDJD  I CANT STAND YOU  
1611,Ladies heres how to recover from a date you totally BOMBED according to men  
4087,40 displaced by Ocean Township apartment fire NewYork  
7777,Acting Public Information Officer PIO Until Monday August 10  
6362,Barak will Tell the American People that the lives of the Hostages in Iran depends on Congress Voting to give Terrorist a Nuke for hostages
9652,"Thunderstorm in Helsinki
thunder lightning lightningstrike thunderstorm nature Helsinki "
8316,360WiseNews  Chinas Stock Market Crash Are There Gems In The Rubble 
4222,Youre getting drowned out yet I still search for you
7666,I added a video to a YouTube playlist  Panic At The Disco I Write Sins Not Tragedies OFFICIAL VIDEO
263,TanSlash waiting for an ambulance
5176,5 Rejected Mortal Kombat Fatalities Mortal Kombat has stretched the boundaries of its  
2251,"Lindenow 315pm
Emergency crews are at a chemical spill in the main street near Church Street"
