,text
9254,It still hasnt sunk in that i will never see my nan again how has it been 2 months already 
4748,30 seconds for my bitches to evacuate 
1864,I burned myself today on the oven  it was at 500 degrees 
3062,CDCwhistleblower 2 deaths from measles complications in 10 yrs everyone looses their shit 8 dead from Legionnaires in a month amp crickets
7040,Tonight Its Going To Be Mayhem  4PlayThursdays Everybody Free w Text 1716 I ST NW 18 
4047,Youssefyamani add Fez weather to the equation and you have the best recipe for disaster
3226,Businesses are deluged with invoicesx Make yours stand ou with colour or shape and its likely to rise to the top of the pay pile
4106,The Best DroughtTolerant Perennials  
10855,Evacuation order lifted for town of Roosevelt  
3404,Heres what caused a Metro train to derail in downtown DC 
4108,MakeWaterWork Okanagan Drought rating maxed out  Okanagan Valley   WesternCanadaDrought
4035,Deepwater drill company gains 735m Transocean one of the companies associated with BPs Deepwater Horizon oil well disaster recovers
1663,I think bombing Iran would be kinder 
2146,MasochisticMage  catastrophe It caused people to get reckless and the bottom line is that at least three of your friends will have 
3563,Shaping the to come multimillion chop local billet frugal else companionate anacrusis production desolate in 
3719,Black Eye 9 A space battle occurred at Star O784 involving 3 fleets totaling 3942 ships with 14 destroyed
5224,fatality
10184,Vickie627 Desert Storm was an unqualified victory a treaty was signed  Under Clinton the situation only got worse and more violent tcot
1173,anellatulip there is a theory that makes way too much sense that says that the dwarves may be the actual origin of the blight
375,Whippenz We need help Horses will diePlease RT amp sign petitionTake a stand amp be a voice for them gilbert23 
5272,Fear Factory  Cars Official MusicVideo 
3178,Euro Ensembles much more optimistic for the weekend even though their operational counterpart is a deluge
8749,ryandefreitas for me its Revs Per Minute but the opening tune on Siren Song is UNREAL
9452,NC Senate follows House on legal action on terrorism damages  Winston 
7555,Wowthe name LegionnairesDisease comes from an outbreak of pneumonia at the AmericanLegion convention in Philly in 197629 died from it
6956,"Massacre at Sinjar  Has the World Forgotten the Yazidi 

 yazidishingalgenocide EzidiGenocide"
7737,When he lets you drive his truck and you start panicking because you had to flip that bitch  
1714,Sport  Shane Warne and Ricky Ponting shocked by Australia batting collapse at Trent Bridge Australian grea 
6623,MY SCHOOL IS INUNDATED and they wont let us go home til 4pm help
5024,Read an eyewitness account from Hiroshima from this day in 1945   LIFE
4925,Alltheway80s I had a similar thing with John carpenters the thing one girl threw up when the dogs exploded
8071,Last Chance Animal Rescue has 3 new posts  animalrescue  
6609,So it doesnt mean inundated with tweets Dictionarycoms WordoftheDay  twitterpated  UseYourWords author writer
9405,Haunting memories drawn by survivors 
2180,How should a society respond to a looming crisis of uncertain timing but of catastrophic proportions 
2355,That PPact hasnt already collapsed is a testament to TheDemocrats lockstep devotion to politics over reality
7466,Why did God order obliteration of ancient Canaanites   
3350,whomikejoness I hate seeing the boy get fucking demolished like this
2726,WRAPUP 2US cable TV companies shares crushed after Disney disappoints 
5624,Flooding kills 166 displace over one million in Pakistan  Daily News amp Analysis 
475,Lets talk some more about your goof guild Saunders Come right up here on stage 
2877,Lets say a tree falls on your fence Do you know how your homeowners insurance may help  
1349,"If a truckload of soldiers will be blown up nobody panics but when one little lion dies everyone loses their mind
"
9791,BoyInAHorsemask its a panda trapped in a dogs body
10268,DebateQuestionsWeWantToHear If U start another war would U B willing 2 go 2 the warzone yourself or send UR sons andor daughters 2 fight
3264,Ugh So hungry Im going to demolish this food
4754,Evacuate from your life
7669,Despite the crippling anxiety and overwhelming panic attacks Id say Im fairly welladjusted
3574,StevieDE83 roathboy Im desolate no idea how Ill ever get over it badgeofhonour
3968,70 Years After Atomic Bombs Japan Still Struggles With War Past The anniversary of the devastation wrought b 
111,TrafficSouthE roadpoleast Accident on A27 near Lewes is it Kingston Roundabout rather than A283
4917,Im Dead My two Loves in 1 photo My Heart exploded into a Million Pieces   BrandonSkeie samsmithworld 
2645,I crashed my car into a parked car the other day modestmouseremix truestory
7667,Panic attacks are always lovely
9312,ScienceDaily Parental experience may help coral offspring survive climate change 
8667,150Foot Sinkhole Opens In Lowndes County Residential Area 
8237,Sweetpeas are running riot at the allotment  and brightening up a rainy day 
6352,hot  C130 specially modified to land in a stadium and rescue hostages in Iran in 1980  prebreak best
3006,my vibrator shaped vape done busted
6853,Candlelight vigil at my house tonight for the victims of the mass ant murder by me in my bathroom sink There will be snacks
8035, whao 12000 Nigerian refugees repatriated from Cameroon 
792,90sAngelicMalik listen to wtm avalanche and take a deep breath
1507,Womens Tote Faux Leather Handbags Shoulder Cross Body Top Handle Bags Rose  
7307,"Germany has  39 gigawatts of installed solar capacity
One gwatt is about equal to the capacity of a nuclear reactor
"
4053,POTUS StrategicPatience is a strategy for Genocide refugees IDP Internally displaced people horror etc 
7096,Inspectors So Far Denied Access to Irans Scientists  Wall Street Journal  
2897,Got my first damage today  fuckkkkkk
963,I liked a YouTube video  Minecraft Episode 2 Blaze Farm Beginnings
8214,"abrancaballero Discovered by NickCannon 
 ListenBuy realmandyrain RIOT on iTunesMusic iTunes   BlowMandyUp"
9453,Politics Democracys hatred for hate  Dawabsha threaten to erode Israeli democracy Homegrown terrorism ha  
1283,I entered to win the ENTIRE set of butterLONDON Lip Crayons via beram0s  Go enter bbloggers 
8149,world Fears over missing migrants in Med Rescuers search for survivors after a boat carrying as many a  news
10766,Wreckage Conclusively Confirmed as From MH370 Malaysia PM Investigators and the families of those who were 
3605,Obama 2016  The Abomination of Desolation 
7595,Tube strike  absolute pandemonium
3017,Obama Dont worry the good Iranians are just kidding with the death to America chants The bad ones are those just like Republicans
4308,The dust storm chase scene is pretty damn cool GhostProtocol
411,Its an apocalypse
987,DanRyckert drewscanlon Hes blazing through this game with the best stealth skills yet Nothing beats the silenced M4
1643,Setting4Success Bells toll in Hiroshima as Japan marks 70 years since atomic bombing News smallbusiness entrepreneur
9768,Been signed off work for a week as i have a trapped nerve and can not move Life is a struggle right now 
1278,Add these items to your everyday eating habits Please do the research on how to take with your blood 
1982,Bushfire causes first victim in Albania   The multiple fires in Albania have caused the first vict  Bush
10338,"The thing with rules is break it once it becomes easier the next time
  "
10828,Wrecked today got my hattrick 
10010,Want Twister Tickets AND A CHANCE AT A VIP EXPERIENCE To See SHANIA CLICK HERE 
9696,Loving you was like throwing a lasso around a tornado I tried to hold on to
7637,Pandemonium In Aba As Woman Delivers Baby Without Face Photos According to eye witnesses in Ogbor Hill in A 
1126,Bitch done blew my shit up
8980,The skys clear the storm has passed but its still raining in my head
3381,Last chance to work at the old FFA foodstand at the fairgrounds We are finishing demolition at 9am  Any help would be appreciated
10158,RoxYunkFalls August 4 1915  Violent storm strikes city Manayunk flooding and damage Sports amp War news
7463,tiggr why only Squad Obliteration
7035,Oh Shelly your waffle wasnt a little blonde Your waffle was Madonna circa 1987 NowYouKnow MasterChef
8348,Im so anxious though because so many ppl will me watching me meet them and that makes me uncomfortable BUT I CANT LET THAT RUIN THE MOMENT
588,Arson suspect linked to 30 fires caught in Northern California  via latimes
2820,GREAT CONDITION Easton Cyclone Softball Bat Fastpitch 9 2920 SK398  
8884,"anti cigarette smoking commercial comes on
me goes outside and smokes
thanks for reminding me to go smoke lol"
6720,I lava you
7604,BlizzHeroes Would love to see a Diablo map themed after places like Westmarch or Mt Arreat or Pandemonium
1973,marcoarment Middle of winter in Sydney we have had snow bush fires and 78 degree days in the last week  Keeps you on your toes for sure
1586,At this hour 70 yrs ago one of the greatest acts of mass murder in world history occurred when Hiroshima was bombed 
2032,EskSF there are always casualties when doing the right thing especially if its going to cost your boss money
720,im feeling attacked 
8427,Watch This Airport Get Swallowed Up By A Sandstorm In Under A Minute 
5134,The Five Fatal Flaws in the Iran Deal  via YouTube
9621,New event Severe Thunderstorm Warning from 852015 950 PM to 1030 PM CDT for Oklahoma County Mo
7875,Officials Alabama home quarantined over possible Ebola case 
9562,Am I hearing thunder or trucks
6871,Plane debris is from MH370  it was a controlled crash In other words it was mass murder by a musim  newscomauHQ
2461,FarhanKVirk PTISalarKhan  Instead of promoting false news first get your facts right  It was a road rage incident  Vehicles collided
5431,Volunteers served first responders today during a tanker fire in Eufaula Provided cold drinks and food okwx tankerfire
8179,Photo theonion Rescuers Heroically Help Beached Garbage Back Into Ocean 
6307,IS Egypt affiliate threatens to kill Croatian hostage in 48 hours  
9228,PKK Suicide Bombing Kills 2 Soldiers in Turkey 
7443,Just absolutely obliterated a moth my new purchase is boss
1792,They are evacuating buildings in that area of State Road 20 We still dont have confirmation of what is on fire
8412,Watch This Airport Get Swallowed Up By A Sandstorm In Under A Minute 
8533,blanksocietyx emmerdale IM SCREAMING HES MY FAVOURITE
8968,this storm
6432,Brooklyn Sites Get 26 Million to Undo Hurricane Sandys Toll 
10029,This is my jam Riser by Dierks Bentley 1061TheTwister  iHeartRadio NowPlaying  
5601,Myanmar Flood Victims Need More Relief Aid and Food Regions struggle with flood aftermath and dwindling suppl 
1472,Im2aD I was going to tell him but you were body bagging him
7699,OKAY I CANT FIND IT SO IM KINDA PANICKING
3643,np agalloch  the desolation song
6452,chikislizeth08 youre not injured anymore 
9109,Pic of 16yr old PKK suicide bomber who detonated bomb in Turkey Army trench released  
7612,Pandemonium In Aba As Woman Delivers Baby Without Face Photos 
6177,"Graham Phillips Fundraiser Canceled By JustGiving 

fundraise Ukraine donbas 

 "
37,No wayI cant eat that shit
5695,Children in Myanmar face a double catastrophe as floods hit the most  
10353,Im all in favor of keeping dangerous weapons out of the hands of fools Lets start with typewriters
1005,Im blazing rn and theres nothing you can do to stop me
8222,ModiMinistry Stuart Broad Takes Eight Before Joe Root Runs Riot Against Aussies 
7886,Alabama home quarantined over possible Ebolacase 
3990,10M SETTLEMENT attained using our illustrations to help jurors understand the true devastation of internal injuries 
2463,I scored 111020 points in PUNCH QUEST stopped when a squeaky bat collided into my skull 
501,22Beyonce Is my pick for  Fan Army Beyhive 
4023,WHAT A DISASTER FOR SECRET  TI5
10031,ellenfromnowon 7speed nexus shifter 9 For community cargo bike 
4553,"This from The City of Calgary  

City of Calgary has activated Municipal Emergency Plan

The Municipal Emergency "
2668,Love love love do you remember your first crush  
4930,"that exploded amp brought about the
beginning of universe matches whats
mentioned in the versethe heaven and Earth
thus the universe"
4416,danisnotonfire dont let Phil help out hell probably electrocute himself
8614,TBI early brain aging and a seismic analogy  deetelecare TBI braininjury
5940,"Whoever got compared with Hazard faded away one by one 
Kagawa 
Januzaj 
Di Maria 
Whos next"
4884,After having two cans explode I wanted to drink the rest but these  Kaldi Coffee Stout  photo
1979,Slashandburn blamed for bush fires in western St Thomas  
9023,I should have known better than to think Id get anything done after a 2 hour capoeira class Stretcherbearer
10271,T Shirts 10 male or female get wit me 2 days until its game changin time War Zone single will be 
9938,why is it troubleniallhariss  simplyvain live on 
3766,"Every kingdom divided against itself is headed for destruction and no city or house divided against itself will stand
Matthew 1232"
9358,Babypicturethis SNACKS SNACKS SNACKS Snacks is how we survived flights with WampP when they were wee
349,US National Park Services Tonto National Forest Stop the Annihilation of the Salt River Wild Horse  via Change
5359,Will be dropping fire selfie tomorrow saying youre welcome ahead of time
2743,So many Youtube commenters saying the Dothraki would get crushed if they came to Westerosnah bro you underestimate the Dothraki
2891,Glaucoma occurs when fluid builds up pressure inside eye to a level that may damage optic nerve eyefacts
10464,They should just have load shedding permanently and we will all just live like we in the wild and have camp fires  cook with fire etc
6141,0day bug in fully patched OS X comes under active exploit to hijack Macs 
4671,Men escape car engulfed in flames in Parleys Canyon crews investigating cause   
2500,Stepkans Media  Two confirmed dead after the boat they were travelling in Collided in LVictoria 
5347,zaynmalik dont overwork yourself Your album is gonna be fire just dont overwork or stress I love you take care
1693,Two giant cranes holding a bridge collapse into nearby homes  via 
1903,fear the fever Can you feel it now I feel the fire Burning beloooow Its gonna trick ya Swallow you whooooole MTVHottest Justin Bieber
2247,bendwavy emergency chemical rinse
2501,Cyclist who collided with runner on Roanoke greenway wins 300000 civil verdict  Roanoke Times Cyclist who c 
1916,If Youre Not Paying Attention to Your Influencers Youre Burning Money  SocialTimes 
5093,I would rather dwell in the land of famine and be in Gods perfect will than to rest in the confines of Egypt 
428,Also my other nephew is proof that fat babies are going to save us from the apocalypse 
5541,JimMozel puckflattened ball lol
8236,Southeast Dirt Riot Series Crowns Champions  Southeast Dirt Riot Series Crowns ChampionsBLACKFOOT ID The So 
868,BreakingNews  FedEx no longer willing to transport research specimens of potential bioter 
7827,missambear your Tweet was quoted by WIRED  
7195,shes a natural disaster shes the last of the American girls 
3281,MarioMaraczi Im watching it right now  He freaked out after the 1st  First fight where he didnt demolish the guy
6265,hot  Funtenna hijacking computers to send data as sound waves Black Hat 2015  prebreak best
5505,Maryland mansion fire that killed 6 caused by damaged plug under Christmas tree report says  Into the flames 
5614,Warlordqueen he thrusts a little more before he jams his cock deep inside her flooding her womb and pussy with his hot thick cum
6268,USAgov Koreans are performing hijacking of the Tokyo Olympic Games
6029,Skinny Jeans are Hazardous for Your Health 
3469,UPDATE NoPassenger Metro Train Derails Causing Terrible Delays This Morning A derailed train is causing a hell 
391,US National Park Services Tonto National Forest Stop the Annihilation of the Salt River Wild Horse  via Change
1172,justinfenton Per my Sun piece from last year I think this is the opposite of what should be done Urban Blight should be monumentalized
9043,Investigators say a fatal Virgin Galactic spaceship crash last year was caused by structural failure after the 
1241,SetZorah dad why dont you claim me that mean that not right we look the same same eyes same blood same xbox 360 SMH 
5470,the fires of hell for Julie Extant writersshe better go down in flames when this is all overExtant
6442,NewsBreaker sothathappened SO wheres the story Anybody injured Where did this happen
5350,This nigga Cyhi diss was what Meek was suppose to do This shit actually fire
10579,A few more photos from this mornings windstorm Weve never seen anything like it rhodeisland warwick
10835,Pic of 16yr old PKK suicide bomber who detonated bomb in Turkey Army trench released  
2787,INFO R CURFEW IN OPER UNTIL 2030 Z TAXIWAYS FOXTROT 5 amp FOXTROT 6 NAVBL WND 0605 EXP INST APCH RWY 05 DAMP TMP 10 QNH 1028
3357,Draw Day Demolition Daily football selection service that consistently makes money lay yo  
1424, New Ladies Shoulder Tote Handbag Faux Leather Hobo Purse Cross Body Bag Womens  
3681,Lets destroy Twitter with fouseyTUBE zaynmalik come on BrBrS lets do it in morning with fousey
7963,The Latest More homes razed by Northern California wildfire The latest on wildfires burning in California and 
3985,Is This Country Latin Americas Next Argentina One week ago we reported on the economic devastation in he o 
4373,USGS reports a M194 earthquake 5km S of Volcano Hawaii on 8615  10401 UTC  quake
2097,reriellechan HE WAS THE LICH KINGS FIRST CASUALTY BLOCK ME BACK I HATE YOU 
6027,HAZARD  HAZARDOUS CONDITION at SB I5 FWY AT  SW TERWILLIGER BLVD PORTLAND OR Portland Police PP15000266858 1726 pdx911
8365,every time I have a really good day someone just has to ruin it
8295,If you go on with this nuclear arms race all you are going to do is make the rubble bounce  Winston Churchill
2325,Ashes 2015 Australia totally collapse and the internet absolutely loves it 
3132,What Irony Debris of Flight MH370 found on Reunion Island
9761,IM TRAPPED IN THE DAMN GAS PUMP THERE ARE TWO SUVS ON EITHER SIDE FUCK YOU DICKHEADS
1028,BlazingRoselia California is hot but not blazing even though there are wildfires going on now Even the big massive Rocky fire
9810,in response to trauma Children of Addicts develop a defensive self  one that decreases vulnerability 3
2286,SZMNextDoor I got this cute lil cliff you can fall off of
3514,Consent Order on cleanup underway at CSX derailment site  Knoxville News Sentinel  
9620,NWS has Continued a Severe Thunderstorm Warning for OklahomaOK until 1030 PM
4070,Job event targets displaced Double 8 employees  
1346,On ThisDayInHistory in 1862 Confederate ship blown up by crew Read More  via History
2249,Emergency services called to Bacup after strong chemical smells 
2599,Crash helmet silvery floors karnal fat shoot sampling 33 PBCaNPCx
9013,Stretcher Grazed witter Rexyy Towel thanks aiden
3089,HighQualityBird a reverse situation lol I dont know 911 where US civilian deaths were specifically utilized to make a political
658,93 blasts accused Yeda Yakub dies in Karachi of heart attack  Mumbai
6087,The Prophet peace be upon him said Save yourself from Hellfire even if it is by giving half a date in charity
5652,Myanmar MSF assisting thousands as worst flooding in decades hits parts of Myanmar 
5211,EBROINTHEAM jaybig Lpunbiggiewrap overzero questionfatalityflawless victory 
574,Mourning notices for stabbing arson victims stir olitics of grief in Israel Posters for Shira Banki and A 
3562,"Weve become desolate 
Its not enough it never is"
2454,Cyclist who collided with runner on Roanoke greenway wins 300000 civil verdict  via roanoketimes
10756,Wreckage Conclusively Confirmed as From MH370 Malaysia PM Investigators and the families of those who were 
5961,Freak accident Sure Looking for someone to blame Maybe Remember that player broke his leg cuz cart was at back of end zone Common sense
10536,Windstorm lastingness perquisite  acquiesce in a twister retreat ZiUW 
8335,New post Chinas Stock Market Crash Are There Gems In The Rubble 
8775,EnvySeven My beautiful Aquarius queenmy Siren of the cliffs and pretenses of overturesPlease sing this phantom songfor you alone shall
5913,IF ANYONE WERE TO HARM THE BOYS THEY WOULD GET TAKEN DOWN IMMEDIATELY NOT BY SECURITY BUT BY THE FANS REAL QUICK
3703,Black Eye 9 A space battle occurred at Star O784 involving 2 fleets totaling 3946 ships with 14 destroyed
382,US National Park Services Tonto National Forest Stop the Annihilation of the Salt River Wild Horse  via Change
3384,JohnnyDetroit Tag Team for me was Demolition  Awesome intro song scary looking and just destroyed there opponents
1426,Photo bonesymcbones Beartooth  Body Bag x 
1754,People are more worried about the burning of buildings than black people losing their lives disgusting
1623,She didnt even notice me in the background Im a floatin head bombed 
7132,13 reasons why we love women in the military    lulgzimbestpicts  
1378,anarchicteapot BoironUSA zeno001 Glononium 6C also helps with being blown up while bashing a bottle of nitroglycerin against a book
606,Arson suspect linked to 30 fires caught in Northern California 
9558,The most prescient part of Tropic Thunder was that fatsuit fart comedies would use the 2401 aspect ratio
8189,"Rescuers recover body of 37yearold Calgary man from lake near Vulcan 
                            
              "
245,Could a drone cause an airplane accident Pilots worried about use of drones esp in close vicinity of airports  
2112,Borrowers concerned at possible interest rate rise This could be a catastrophe 
1100,well this tweet blew up fast
2737,GoT season 5  funniest season ever Hilarious GameOfThrones you crushed it OMG CantStopLaughing Wow Comedy
8100,Trust us to get rescued by the dopey ones Val is hilarious shame shes probably going to die emmerdale
2430,Check out my new song Collide live at the Bowery Electric 
2512,COLLISION Hwy401 EB just east of Hwy 8 Cambridge Single vehicle blocking the left lane OPP enroute ag
1289,A Nightmare On Elm Street Is Getting Remade Again  
7508,Got the gas and the splash like an oil spill
9790,Hollywood Movie About Trapped Miners Released in Chile  newsdict news  Chile
4967,Young dancer moves about 300 youth in attendance at the GMMBC Youth Explosion this past Saturday Inspiring 
10815, Cramer Igers 3 words that wrecked Disneys stock 
5683,casewrites when it rains in NJ it flash floods Otherwise its just a desert of grief and taxes
6651,Is this the real life Is this just fantasy Caught in a landslide No escape from reality
8979,"NASAHurricane EASTERN PACIFIC Full Update Satellite Sees Formation of Eastern Pacifics Tropical Storm Hilda
Th "
9521,To whom we shld ask tht from where this bldy PAK terrorist has entered in our country
8673,Damn that sinkhole on sunset
857,FedEx no longer will ship potential bioterror pathogens  FedEx Corp NYSE FDX will no longer deliver packages  
512,Vote for Directioners vs Queens in the 5th round of the Billboard FanArmyFaceOff 
8558,drag0nking0201 Screamsdont scare me and its Animatronics
2627,Pak Army Helicopter crashed in Mansehra
1809,BigSim50 nah Philly pundits are half the cause They set buildings on fire to report on buildings being on fire
4679,Why tf did I decide to workout today My body feels like its been engulfed by a mass of fiery disdain
3816,"Real Hip Hop Apollo Brown Feat MOP  Detonate 
JTW "
2103,Small casualty on the way to Colorado 
5435,pnppro1 Warm Up exercise of the trainees on Basic First Responders Training Course 
840,FedEx to stop transporting bioterror germs after lab mishaps FedEx has stopped transporting certain research  
9283,Its like I never left I just sunk to the background
8615,Sismo DETECTADO Japn Report 1 010156 Okinawa Island region M40 Depth 10km Maximum seismic intensity 3 JST 
4722,Okay I need all of you to evacuate the house so I can write this poem
767,the fall of leaves from a poplar is as fully ordained as the tumbling of an avalanche  Spurgeon
7697,underrrtow molly send help im panicking over 6th form clothes what do i do
4516,newyorkcity for the international emergency medicine conference w Lennox Hill hospital and drjustinmazur
5051, Eyewitness to ExtremeWeather 
6991,Thus ends the clam massacre of 2015 clambake showgirldayoff 
8686,"Sinkhole leaking sewage opens in housing estate
Irish Independent3 Aug 2015"
7925,Landslide in Italian Alps kills three  ROME Reuters  Three people were killed when a severe rainstorm in the I 
3054,Bigamist and his irst wife are charged in the deaths of his econd pregnant wife her child 8 her mother her nephew 1 and their u
1026,I still dont know how 8 hours of physical activity in the blazing sun isnt a sport
10615,wocowae Police Officer Wounded Suspect Dead After Exchanging Shots  ushed
8982,DovahSwag GrayGreymane DotA 2 gt Heroes Of The Storm gt League Of Legends
7985,ABC News The Latest More Homes Razed by Northern California Wildfire ABC News The latest on 
6312,The horrific story of being a hostage  The horrific story of being a hostage Its 1974 and on a British 
10578,Texas Seeks Comment on Rules for Changes to Windstorm Insurer  via ijournal
9916,canagal Good to hear its back that storms been given you guys trouble though  SJ
870,FedEx no longer to transport bioterror germs in wake of anthrax lab mishaps  via usatoday
9218,RayquazaErk There are Christian terrorists to be sure but I dont suicide bombing is employed often as it is in Islamic groups
5855,Summer heat drives bobcats to Calgary backyards  35  
5996,foodscare offers2go NestleIndia slips into loss after Magginoodle ban unsafe and hazardous for humanconsumption
396,Im gonna fight Taylor as soon as I get there
1990,28 Oct 1895 Bush Fires 
