,text
4887,Learn How I Gained Access To The Secrets Of The Top Earners amp Used Them To Explode My Home Business Here  Please RT
4701,LIVE on Periscope Wild Wing Epicentre 
2024,A poignant reminder that in war there are many casualties 
553,"SHOCK REPORT Muslims Setting Wildfires Across American WestArson Jihad

"
3509,"MP trains derailment ts the freakiest of freak accidents 

MP trains derailment ts the freakiest of  "
1333,"Yes they know youre an adultress
And yes they HAVE Killary emails

Like the smoke being blown up ur azz

NSA

"
7625,Pandemonium In Aba As Woman Delivers Baby Without Face Photos  
7288,3 Former Executives to Be Prosecuted in Fukushima Nuclear Disaster 
1391,New Ladies Shoulder Tote Handbag Women Cross Body Bag Faux Leather Fashion Purse  Full re  
945,Property losses from California wildfire nearly double as weekold blaze rages 
6003,JKL issues Hazardous Weather Outlook HWO   WX
290,Whats the police or ambulance number in Lesotho Any body know
8937,This week on dream from last night my mom drove my car in a snowstorm She hit another car while parallel parking Saw my first ex
844,Unsurprisingstill dismaying consequences of how we went about securing pathogen access 
5525,Would have just flattened the little midget  
220,Horrible Accident Man Died In Wings of Airplane 29072015 
9211,Remembering Rebecca Roga 40 of the Philippines murdered by Hamas terrorists in the suicide bombing of Egged bus No 361
6886,Conservatexian Farrakhan calling for 10000 men to rise up amp commit mass murder 
8022,Top story ViralSpell Couple spend wedding day feeding 4000 Syrian refugees  see more 
9823,Photo lavenderpoetrycafe The Forgotten History of Sexual Trauma Hysteria was an affliction seen primarily 
10000,I liked a YouTube video  Call of Duty Ghosts  Campanha  EP 6 Tsunami
6678,CrowtherJohn Effiedeans  you just keep ur head in the sand john The best place for it  Lbr after 97 landslide Couldnt imagine situ now
5699,"Who is bringing the tornadoes and floods Who is bringing the climate change God is after America He is plaguing her
 
FARRAKHAN QUOTE"
1711,2 Injured 1 missing in bridge collapse in central Mexico 
5704,Typhoon Soudelor approaches after 7 killed 2 missing in floods in Philippines  Typhoon
2207,SyringeToAnger  and probably even more But some disagreements with General Ross and the catastrophic occurrence made something clear 
1171,Detroit has made progress against blight but too many burned out shells of houses remain
4086,Myanmar  Displaced Rohingya at Sittwe point of no return   Prison like conditions genocide IHHen MSF Refugees
5599,Spot Flood Combo 53inch 300W Curved Cree LED Work Light Bar 4X4 Offroad Fog Lamp  Full re  
1107,funnychubbyguy poor white guy his mom made him pizza and he wanted mac n cheese so he blew up a school Such a sad story
5807,Hail Mary Full of Grace The Lord is with thee Blessed art thou among women and blessed is the fruit of thy 
1198,BlizzardGamin ight
6587,We live in an area thats inundated with wildlifeIf people dont learn how to get along or live with them 
8663,beforeitsnews  A sinkhole grows in Brooklyn sixmeter crater swallows street   
2181,MyVintageSoul of the British upper class and his manservant  The pampered wealthy Brit causes a catastrophic shift reversal of
2946,I am not in danger Skyler I AM THE DANGER
4342,Going to a fest Bring swimming goggles for the dust storm in the circle pit
3047,The first trial in the death of CecilTheLion was just postponed  
1976,OMFG there are bush fires all over this tiny island Our freaking house is gonna burn down
10592,One man fatally shot another wounded on Vermont Street Buffalo  
760,cierranb5678 I was just there and my dad told me he would never let me get an Avalanche
1578,My aunt just gave me this drink at the game and its bomb Ill never tell what in it though shhhh 
7464,bradohearne Admin is the little death that brings total obliteration
2002,If you like goats and dislike bush fires then this is probably the video for you 
7311,Nuclear reactor railguns would be a great way to deliver t1000s
3107,Discovered Plane Debris Is From Missing Malaysia Airlines Flight 370  TIME 
653,Demi stans really think Heart Attack sold 56 million copies 
791,Avalanche City  Sunset  nowplay listen radio
3883,Ignition Knock Detonation Sensor ACDelco GM Original Equipment 213296  
9987,Man my stomach feel like a tsunami 
1900,Uhhhhh demon hunters But not the whole Burning Crusade v 20 thing  
5701,Im so dried out in this desert let me know I wanna be with you speaking of floods speaking of truth  Laleh 
6192,San Jose Mercury Governor Brown allows parole for California school bus hijacker  
10326,KnaveTBE lol Not the class but the class of weapon
10388,BarstoolBigCat what a whirlwind
6037,rawfoodbliss Im in the middle of a humid heat wave and a patch on my forehead flared up I take olive oli extract and 4 tbs olive oil
1866,I PUT MY CHICKEN NUGGETS IN THE MICROWAVE FOR 5 MINUTES INTEAD OF 1 ON ACCIDENT AND THEY FUCKING BURNED
3964,HungerArticles Nepal Rebuilding Lives and Livelihoods After Quake Devastation 
1968,I Pledge Allegiance To The POPE And The Burning Buildings of Epic City 
8770,optich3cz askH3cz im jealous now Bc i wanted a elgato hd for my bday so i can record videos but i didnt have the money for it
8235,Trollkrattos Juan Carlos Salvador The Secret Tips to Get 100000 Riot Points LoL are out now check the Secret on on my Bio
10605,"Have you ever seen the President 
who killed your wounded child
Or the man that crashed your sisters plane 
claimin he was sent of God"
5222,Dying of Lyme disease Case fatality rate nearly 100 
1918,ika tuning Soup diet recipes  fat burning soup recipes  Fat Burning Soup Diet Recip 
9816,games that I really hope to see in AGDQ Trauma Center Second Opinion Kororinpa Marble Mania TLoZ Oracle of Ages Metroid II
1415,"handbag fashion style  Vintage Coach Purse Camera Bag Cross Body 9973

1699 0 Bids
 "
9104,Pic of 16yr old PKK suicide bomber who detonated bomb in Turkey Army trench released  
8272,foxandfriends where is protest looting and rioting that is for ignorant people
5719,Sweet2Young runs at her for setting my forest on fire and bites the shit out of her neck
896,MeyerBjoern thelonevirologi MackayIM of a major American newspaper running a series on all the alleged bioterrorism research going on 2n
8641,Statoilasa amp TOTAL make significant discovery in the North Sea Visualise the full potential on our seismic     g 
9077,sirtophamhat SCynic1 NafeezAhmed jeremyduns and of course you dont have to melt the steel in order to cause structural failure
6505,nalathekoala As a health care professional that deals all gun violence sequalae I consider suicides injuries accidents and homicides
2204,Pretty much every time the audio dies on an audio stream for a baseball game I assume catastrophic nuclear attack
9069,NewsHour Investigators rule catastrophic structural failure resulted in 2014 Virgin Galactic crash 
6120,ggkeeponrockin StrawberrySoryu Oh okay I just got the message twice and got suspicious Sorry  Ill check it out
5397,Truck fire clogs canyon road 
3730,A person who blows himself up to kill others has no life in heaven because his ethereal body gets destroyed by doing it
9945,TJRobertson2 no bc we always got in trouble for laughing too much 
7742,you can stop panicking  ogtomd  
3751,World of Warcraft Legion Revealed at gamescom The Burning Legion returns to bring destruction to Azeroth onc 
1286,ashwilliams1 continues to be the best guest on iLoveGGLetters This weeks episode is bloody outrageous
3741,hotteennsfwpornmilf Oiled Up Ass Hole Is Destroyed With King Size Cock Closeup Sex Clip 
7438,Drunk Meals 101 What To Cook When Youre Totally Obliterated 
4724,Cascada  Evacuate The Dancefloor Official Video  via YouTube
3959,ssssnell yeah I agree but its the shock factor that ropes people in if they just show devastation then it angers me
2671,PYDisney que crushMTVHottest Justin Bieber
6978,freddiedeboer Thucydiplease then you have rise of Coates Charleston massacre Walter Scott and black twitter more broadly as well
1143,toddcalfee so mattburgener wanted to see that info on blight u got
8313,Chinas ecommerce firms Alibaba BABA Tencent  JD are still growing revenue at 40 
1226,"Someone walk with me to DQ 
I wanna Butterfinger Blizzard so bad"
5323,Im crying that song just ended setting myself on fire  
5213,TrulyStings Yo Dm me
7636,The move Saturday gt Mirage 400 N West st Raleigh NC 21  Tickets at 
1072,ColoicCarnality You were bleeding my instincts kicked in She looks away and scratches the back of her head
4857,ariabrisard leiaorganasolo Good Play along with her You may begin your operation with the death star The evacuation is nearly complete
7941,That rainstorm didnt last nearly long enough
2681,I was freakingg out and he was playing candy crush 
7148,STERLINGSCOTT on the Red Carpet at a fundraiser for OSO Mudslide  
8654,Gaping sinkhole opens up in Brooklyn New York 
10671,I keep scrolling to find out what he said or didbut there seems to be no exact starting point  Wounds run deep  
6818,kiilud Breaking news Unconfirmed I just heard a loud bang nearby in what appears to be a blast of wind from my neighbours ass
6106,IANHellfire I got it for the mistake but boss got it worse cause their job was to oversee my work Boss didnt change after that
9678,Guys he can run so fast he creates a tornado WITHOUT BREAKING A SWEAT He makes Superman look like a slowpoke He can be a POC
9566,KristyLeeMusic brings her Alabama thunder back to the Attic SEPTEMBER 26 Tickets 
1799,Fire hazard associated with installation of noncompliant external cladding on highrise buildings  Insurance  Aust 
3335,Take this China get demolished and sent back to the fucking stone age
9693,deadlast Im going to live out of my car for a year probably 2016 life goals 
4535,StephGHinojosa hey my mom said to tell your dad to call her ASAP its an emergency
10711,GeorgeFoster72 and The Wreck of the Edmund Fitzgerald
8831,Whats going on in Hollywood abc7eyewitness ABC7 helicopters and sirens HometownGlory
1421,Nuu that FAM fwt Im Leave You In a Body bag
843,FedEx no longer to transport bioterror germs in wake of anthrax lab mishaps  via usatoday
3419,Will FoxNews continue to derail the Iran Nuclear Deal during tonights GOPDebate  oh yeah
737,Christian Attacked by Muslims at the Temple Mount after Waving Israeli Flag via Pamela Geller   
8405,Watch This Airport Get Swallowed Up By A Sandstorm In Under A Minute 
6124,Come watch QelricDK bash some face in Hellfire Citadel 
7052,tinybaby adultblackmale mattytalks meltdown mwednesday
136,Suffield Alberta Accident 
2669,Aramis will crush 1 pitch strop
805,Black Eye 9 A space battle occurred at Star M27329 involving 1 fleets totaling 1236 ships with 7 destroyed
64,I wanted to set Chicago ablaze with my preaching But not my hotel 
3522,Madhya Pradesh Train Derailment Village Youth Saved Many Lives
2168,If a 1 rise in wages is going to have such a catastrophic impact on wage structure What the fuck is automation going to do
4039,Four Technologies That Could Let Humans Survive Environmental Disaster  
91,Navista7 Steve these fires out here are something else California is a tinderbox  and this clown was setting my hood ablaze News24680
5567,A small flood with bigconsequences  
922,To fight bioterrorism sir
6315,Murfreesboro peeps Im hearing Walmart on S Rutherford is on lockdown with a hostage is that true or a rumor
4664,just got engulfed in a carinduced tidal wave on my run I thought this only happened in the movies 
4950,rickoshea AnthonySHead NicholasBrendon DublinComicCon RTE2fm WHATTT Oh wow my fangirl head has exploded in a mess of crap everywhere
5085,FinancialTimes Ethiopian regimes continue receiving foreign aid when famine struck for 2 years eastern Ethiopia  
7289,70 years ago today 1945 Hiroshima was the first nuclear atomic bomb leaving a major disaster in the wake 
1,Our Deeds are the Reason of this earthquake May ALLAH Forgive us all
625,Zodiac Girl feat Trey Dupree Produced By Sparkz Beatz  Chuck Da Arsonist 
4082,POTUS StrategicPatience is a strategy for Genocide refugees IDP Internally displaced people horror etc 
9946,charlieputh that song have a Cool beat like Nothing But Trouble
10525,IDFire Cherokee Road and Road 22 Three Sisters Wildfire There are two roads closed to the general public  
7918,Three people were killed when a severe rainstorm in the Italian Alps caused a landslide 
8995,Renewing Your Kitchen Cabinets for 100  
1775,Fire destroys two buildings on 2nd Street in Manchester 
4331,Photoset hookier New stills from The Dust Storm x 
5985,Wholesale WE Gon Rep That hit At All Costs Hazardous WholeTeam3 WholesaleEnt 
6126,Fel Lord Zakuun is about to DIE  Hellfire WOD 
4694,Men escape car engulfed in flames in Parleys Canyon crews investigating cause   
7803,RT skanndTyagi WIRED  Reddit will now quarantine offensive content   
3541,CTA Green Line service has resumed after an earlier derailment near Garfield expect delays WBBMNewsradio
7090,"Byproduct of metal price meltdown is a higher silver price
"
3093,"Cancers equate for around 25 of all deaths in Blackpool 

Kowing the signs could save your life 
BeClearOnCancer"
1131,THDA Kicks Off AntiBlight Loan Effort in Memphis 
8691,Share Large sinkhole swallows entire pond in Lowndes County Georgia A large  YoNews
22,Hey How are you
4629,Emergency Plumber Emergency Plumbing Services plumber localplumber Australia 
1375,HopefulBatgirl went down I was beaten and blown up Then next thing I know Ra Al Ghul brought me back to life and I escaped and for a
2365,I used to have a good time from June to about July 10th then my summer just collapsed smh
413,the apocalypse is upon us
5038,WFTV Eyewitness News TN school psychologist arrested in Florida on child porn charges 
4193,Drown me you make my heart beat like the rain
7665,puzzledtriangle please inform me of that date because that song very accurately reflects the panic of the week before
10297,BUT I will be uploading these videos ASAP so you guys get to see the new weapon types in action
4161,Some days I drown in my tears but I dont let it get me down
10366,Battlefield 1942 forgotten hope secret weapons
3442,BCC Premature interest rates increases could derail the recovery Commentating on todays interest rate decis 
7245,This was amazing Probably couldnt have watched if still living in Japan Scary Nuclear Meltdown Disaster  Nova 
4780,"So many fires in NorCal they cant fight some of them 

Pray for our firefighters air tanker pilots support crews amp evacuated people"
2610,Rip to whoevers face that crashed in front of my work Wish I could have helped
9282,Think its actually sunk in that weve left school 
3799,HJudeBoudreaux Start your car with it Or use it to detonate an evil henchman
1153,  Cleveland Heights Shaker Heights fight blight The House Next Door 
7425,WACKOS like MicheleBachman predict the WORLD will SOON be OBLITERATED by a burning firey INFERNO but cant accept GlobalWarming HELLO
623,Arsonists being blamed for a blaze at a plastics recycling business in Adelaide  pcaldicott7 reports 7NewsAdl 
5769,HeartDisease US Forest Service says spending more than half of budget on fires 
10188,Stay inside for the next little while kids Were having a bit of a violent storm right now kjc
7880,"0nPzp mhtw4fnet

Officials Alabama Home Quarantined Over Possible Ebola Case  ABC News"
3758,Fall back this first break homebuyer miscalculation that could destruction thousands MwjCdk
4937,news science London warship exploded in 1665 because sailors were recycling artillery cartridges A dive to  
7398,Its2015America King O has obliterated the Constitution
10763,The first piece of wreckage from the firstever lost Boeing 777 which vanished back in early March along with the 239 people on board has
5030,Marked as toread DK Eyewitness Travel Guide by Richard Sterling 
10516,Wildfire near Columbia River town is 50 percent contained  FireNews WA 
935,Shayoly yes I love it
153,There is no victory at bargain basement prices Dwight David Eisenhower
604,Suspected serial arsonist arrested in Calif 
2335,Residents set up sign as tribute to families who lost their lives in the Thane building collapse The unfortun  
5214,Any other generation this wouldve been fatality  
8732,This is Lara she likes sinking her teeth into my flesh and clawing my arms  
9977,She kept it wet like tsunami she think she saw the titanic I get it hot like wasabi
5139,spookyfob feelslikefob I am okay thank you yes your kindness is fatal though its like Patrick stump level kindness
9508,Seek help warra MetroFmTalk
6138,Bayelsa poll Tension in Bayelsa as Patience Jonathan plans to hijack APC PDP Plans by former First Lady and 
7300,Has An Ancient Nuclear Reactor Been Discovered In Africa  Your 
5111,Protesters mark year since fatal police shooting in WalMart from AP 
87,CTVToronto the bins in front of the field by my house wer set ablaze the other day flames went rite up the hydro pole wonder if it was him
2654,my brother said he has a crush on a girl named Danielle  OH GOD NO
232," Nicole Fletcher one of a victim of crashed airplane few times ago 

The accident left a little bit trauma for her Although shes 

"
9102, whao Pic of 16yr old PKK suicide bomber who detonated bomb in Turkey Army trench released 
7600,Element of Freedom The Biggest Party of the Summer  Mirage Saturday Tickets at 
837,APHL responds FedEx no longer to transport bioterror germs in wake of anthrax lab mishaps 
679,CaIxxum5SOS thanks for the damn heart attack
7747,Police Gunman reported dead at Nashville area theater A suspect who carried a gun and a hatchet at the Carmi 
4612,Ballina emergency services have again been activated following a shark sighting of what has been described as two 
7722,all that panicking made me tired  i want to sleep in my bed
7087,CommoditiesAre Crashing Like Its 2008 All Over Again  Bloomberg Business 
1739,"Messi has tattoos so he cant donate blood
Ronaldo runs into burning buildings to save dogs respect"
6092,Beware of your temper and a loose tongue These two dangerous weapons combined can lead a person to the Hellfire islam
10349,Hiroshima and Nagasaki I remember all those killed in alleged US war crimes using nuclear weapons  USWarCrimes
10683,Our wounds can so easily turn us into people we dont want to be and we hardly see it happening
7573,Families to sue over Legionnaires More than 40 families affected by the fatal outbreak of Legionnaires disea 
452,Bed time Dont wake me up unless revolution or Armageddon start
1581,Tell Shinichi Kudo that Im giving him 3 minutes to enjoy it Moriya Teiji famous architect from The Time Bombed Skyscraper
1971,Insane bush fires in California Be safe 
759,Musician Kalle Mattson Recreates 34 Classic Album Covers in Clever Music Video for Avalanche 
9330,You cant fight fate and you cant survive alone I cant help but notice that almost seems like a definition of who I am
8055,The Most Generous Bride on Earth Couple Feeds 4000 Syrian Refugees on Their Wedding Day  via thedailybeast love it
809,DU19 who gon get in this rap battle with me
1240,Doing dialyses to my grandpa and oh lord this blood makes me light headed
7690,I added a video to a YouTube playlist  Panic At The Disco The Ballad Of Mona Lisa OFFICIAL VIDEO
9116, Pic of 16yr old PKK suicide bomber who detonated bomb in Turkey Army trench released  
7623,gtgt GidiExclusixe Shock In Aba As Woman Delivers aceless Baby Photo There was pandemonium  BennyCapricon
3468,EpicInsanity It got derailed outside Grimrail Depot
9015,Mind salivation stretcher beds KEGm
9188,Islamic State group claims Saudi mosque suicide blast The jihadist group claims it sent a suicide bomber to  dw
2769,She just said does he have a curfew nope
2123,MaatMHI Slightly diff catastrophe amp Barry was running solo but generally the same thing
5479,gilderoy i wish i was good enough to add flames to my nails im on fire
9467,Pakistans Supreme Court rules to allow military trials for suspects in terrorism cases 
4391,Earthquake drill 
132, it was an accident 
5122,Police man in his early 30s dies after shooting on Vermont St  
758,PATRICK ROY 199899 UPPER DECK SPX 171 FINITE 1620 MADE COLORADO AVALANCHE MINT  
4552,Municipal Emergency Plan deactivated Crisis averted  
1865,Watch how bad that fool get burned in coverage this year Dat dude is allpro practice squad material
10773,Wreckage Conclusively Confirmed as From MH370 Malaysia PM  via ndtv
980,Just cruisingblazing and banging 
5682,all cats are intime for the floods
10489,Parker Ridge Fact Sheet Aug 6 2015 Parker Ridge Wildfire Information Phone 2082676773 Email pa  IDFire
8635,New post from SeismicSoftware 3 Major Challenges of Channel Sales Enablement 
8531,justinbieber ArianaGrande SCREAMING
4204, Jacksonville family bands together as memorial is planned for toddler who   Florida 
9629,Severe Thunderstorm Warnings have been cancelled in central Oklahoma Still expect 50 mph winds penny sized hail
7946,Landslide in Italian Alps kills three ROME Reuters  Three people were killed when a severe rainstorm in th 
4944,ItsNasB now I have to go replace my sarcasm meter which just exploded 
3960,70 Years After Atomic Bombs Japan Still Struggles With War Past The anniversary of the devastation wrought b 
4589,Do you have an emergency drinking water plan Download guide in English Spanish French Arabic or Vietnamese 
3629,cause right now I can read too good dont send me no letters no not unless youre gonna mail them from desolation row 
3444,Do people even ride Metro any more  whywebike bikecommute DysfunctionalRedLine WMATA
6728,"YoungHeroesID 
4 LAVA BLAST dan POWER RED PantherAttack Mirnawan13 Zakiakiia"
6640,womanxking Well youre safe in NY Avoid inundation zones in the pacific north west though
8434,"Come out to Sandstorm tryouts Aug 15th at Lower Woodland
MS Tryout 3430pm
HS Tryout 4306pm"
884,Firepower in the lab electronic resource  automation in the fight against infectious diseases and bioterrorism  
2132,You r a wonderful person   thomasistrash ThomasIsTrash 
9899,for an extra month I was literally traumatised that couldnt been me But I do a recap in a pool every now amp again for safety purposes
6137,"GamerGate Our entire attempt to hijack your community destroy your industry and scam everyone in sight was just sarcastic

Drop dead"
10347,Helpful Tips For Nuking An Asteroid 
3630,I See Fire Ed Sheeran The Hobbit The Desolation of Smaug Cover By Ja  via YouTube
7304,"NuclearDeal IndoJapan pact lies at the heart of two US reactorbased projects  The Indian Express 

Read more "
1218,I love the cotton candy blizzard
3249,Afterwards I had to be alone for an hour to savour and prolong the almost physical intensity of the feelings that deluged me Y sigue
7530,Plains Calif Oil Spill Could be Larger than Estimated 
2415,When high fashion and food collide Gucci has chosen one of Shanghais most popular commercial avenue  fashion
882,I liked a YouTube video  FEMA REGION III TARGETED for BIOTERRORISM  NASA  JAPAN ROCKET LAUNCH with LITHIUM
6516,Why is GOP blocking chance for DisabledVeterans w groin injuries to have children ThePartyofMeanness 
1066,SoDamnTrue  we know who u are youre a bleeding heart wannabe pickup artist
4507,Survival Kit Whistle Fire Starter Wire Saw Cree Torch Emergency Blanket S knife   Full re  
4383,There has not been 1 real tear out of Shelli s eyes this entire episode bb17
8398,Watch This Airport Get Swallowed Up By A Sandstorm In Under A Minute 
6259,hot  Funtenna hijacking computers to send data as sound waves Black Hat 2015  prebreak best
576,Jewish leaders prayed at the hospital where a Palestinian family is being treated after arson  via HuffPostRelig
10635,He was crushed for our iniquities the punishment that brought us peace was upon him amp by his wounds we are healed Isa 535
2928,mlpDelrim Please tell my why they might be in danger if they knew what you knew
2735,Double E Just crushed that ball Jays
674,volleyball Attack II Volleyball Training Machine  Sets Simulation   
3936,argentings WE COULD HAVE HAD IT AAAAAAALLLL Im not even on that season and Im devastated
6684,RakestrawJeff GOP That about sums it up Give them a historic landslide and they do everything King Barack wants Its just incredible
2311,Watch The Terrifying Moment Two Giant Cranes Collapse Onto Homes A row of homes was destroyed in seconds 
3064,Bigamist and his first wife are charged in the deaths of his second pregnant wife her child 8 her  news
10563,My precious olive tree lost this battleanother crazy windstorm in yyc weathernetwork 
9539,RT AbbsWinston Zionist Terrorist kidnapped 15 Palestinians in overnight terror on Palestinian Villages  
8994,Free Ebay Sniping RT  Lumbar Extender Back Stretcher Excellent Condition Please Favorite amp Share
8471,Some kids going to leadership camp came into my work today asking for the bathroom and my inner ASB kid screamed a lot I miss camp 
2235,We know this is bad for the bees  dont give in to pressure from short term profit obsessed chemical companies 
6189,"Remove the  and Linkury Browser Hijacker PITA as it hijacks both browsers and their shortcuts
"
8287,Football hooligan jailed for rioting before game in Scotland was already banned from matches in England UkNews 
3818,NickKristof Contradictory We shouldve tried to detonate on an uninhabited island amp then the alternativescategoricallywere worse
1619,I liked a YouTube video  Benedict Cumberbatch Gets Video Bombed
526,One Direction Is my pick for  Fan Army Directioners 
10287,honey you aint no angel You like to scream these words as a weapon Well go ahead take your best shot woman I wanna leave you its
5177,unsuckdcmetro minor train leaves rails Major  11382 Smithsonian Interlocking derails amp crashes into barrier wall w fatalities
7202,Rationing of food and water may also become necessary during an emergency such as a natural disaster or terror attack
